root@comp3134-Winter2025:~# tcpdump -i any 'tcp and portrange 3001-65535'
tcpdump: data link type LINUX_SLL2
tcpdump: verbose output suppressed, use -v[v]... for full protocol decode
listening on any, link-type LINUX_SLL2 (Linux cooked v2), snapshot length 262144 bytes
18:26:57.149996 eth0  Out IP comp3134-Winter2025.ssh > 198.96.84.204.8841: Flags [P.], seq 3701719127:3701719195, ack 3362592484, win 501, options [nop,nop,TS val 363184933 ecr 3355397578], length 68
18:26:57.150081 eth0  Out IP comp3134-Winter2025.ssh > 198.96.84.204.8841: Flags [P.], seq 68:104, ack 1, win 501, options [nop,nop,TS val 363184933 ecr 3355397578], length 36
18:26:57.151234 eth0  In  IP 198.96.84.204.8841 > comp3134-Winter2025.ssh: Flags [.], ack 0, win 1309, options [nop,nop,TS val 3355397586 ecr 363184930], length 0
18:26:57.153180 eth0  Out IP comp3134-Winter2025.ssh > 198.96.84.204.8841: Flags [P.], seq 104:212, ack 1, win 501, options [nop,nop,TS val 363184936 ecr 3355397586], length 108
18:26:57.153251 eth0  Out IP comp3134-Winter2025.ssh > 198.96.84.204.8841: Flags [P.], seq 212:248, ack 1, win 501, options [nop,nop,TS val 363184936 ecr 3355397586], length 36
18:26:57.153291 eth0  Out IP comp3134-Winter2025.ssh > 198.96.84.204.8841: Flags [P.], seq 248:300, ack 1, win 501, options [nop,nop,TS val 363184936 ecr 3355397586], length 52
18:26:57.153343 eth0  Out IP comp3134-Winter2025.ssh > 198.96.84.204.8841: Flags [P.], seq 300:376, ack 1, win 501, options [nop,nop,TS val 363184936 ecr 3355397586], length 76
18:26:57.153378 eth0  Out IP comp3134-Winter2025.ssh > 198.96.84.204.8841: Flags [P.], seq 376:444, ack 1, win 501, options [nop,nop,TS val 363184936 ecr 3355397586], length 68
18:26:57.153409 eth0  Out IP comp3134-Winter2025.ssh > 198.96.84.204.8841: Flags [P.], seq 444:480, ack 1, win 501, options [nop,nop,TS val 363184936 ecr 3355397586], length 36
18:26:57.154563 eth0  In  IP 198.96.84.204.8841 > comp3134-Winter2025.ssh: Flags [.], ack 68, win 1309, options [nop,nop,TS val 3355397588 ecr 363184933], length 0
18:26:57.154564 eth0  In  IP 198.96.84.204.8841 > comp3134-Winter2025.ssh: Flags [.], ack 104, win 1309, options [nop,nop,TS val 3355397588 ecr 363184933], length 0
18:26:57.158765 eth0  In  IP 198.96.84.204.8841 > comp3134-Winter2025.ssh: Flags [.], ack 212, win 1309, options [nop,nop,TS val 3355397592 ecr 363184936], length 0
18:26:57.158766 eth0  In  IP 198.96.84.204.8841 > comp3134-Winter2025.ssh: Flags [.], ack 248, win 1309, options [nop,nop,TS val 3355397592 ecr 363184936], length 0
18:26:57.158766 eth0  In  IP 198.96.84.204.8841 > comp3134-Winter2025.ssh: Flags [.], ack 300, win 1309, options [nop,nop,TS val 3355397592 ecr 363184936], length 0
18:26:57.158766 eth0  In  IP 198.96.84.204.8841 > comp3134-Winter2025.ssh: Flags [.], ack 376, win 1309, options [nop,nop,TS val 3355397592 ecr 363184936], length 0
18:26:57.158766 eth0  In  IP 198.96.84.204.8841 > comp3134-Winter2025.ssh: Flags [.], ack 444, win 1309, options [nop,nop,TS val 3355397592 ecr 363184936], length 0
18:26:57.158766 eth0  In  IP 198.96.84.204.8841 > comp3134-Winter2025.ssh: Flags [.], ack 480, win 1309, options [nop,nop,TS val 3355397592 ecr 363184936], length 0
18:26:57.251971 eth0  Out IP comp3134-Winter2025.34730 > 67.207.67.3.domain: Flags [S], seq 368259286, win 64240, options [mss 1460,sackOK,TS val 4151189628 ecr 0,nop,wscale 7,tfo  cookiereq,nop,nop], length 0
18:26:57.254161 eth0  In  IP 67.207.67.3.domain > comp3134-Winter2025.34730: Flags [S.], seq 2879567201, ack 368259287, win 65160, options [mss 1460,sackOK,TS val 1749954101 ecr 4151189628,nop,wscale 9], length 0
18:26:57.254198 eth0  Out IP comp3134-Winter2025.34730 > 67.207.67.3.domain: Flags [.], ack 1, win 502, options [nop,nop,TS val 4151189630 ecr 1749954101], length 0
18:26:57.254449 eth0  Out IP comp3134-Winter2025.34730 > 67.207.67.3.domain: Flags [P.], seq 1:47, ack 1, win 502, options [nop,nop,TS val 4151189630 ecr 1749954101], length 46 6974+ PTR? 204.84.96.198.in-addr.arpa. (44)
18:26:57.255515 eth0  In  IP 67.207.67.3.domain > comp3134-Winter2025.34730: Flags [.], ack 47, win 128, options [nop,nop,TS val 1749954102 ecr 4151189630], length 0
18:26:57.255597 eth0  In  IP 67.207.67.3.domain > comp3134-Winter2025.34730: Flags [P.], seq 1:112, ack 47, win 128, options [nop,nop,TS val 1749954103 ecr 4151189630], length 111 6974 NXDomain 0/1/0 (109)
18:26:57.255606 eth0  Out IP comp3134-Winter2025.34730 > 67.207.67.3.domain: Flags [.], ack 112, win 502, options [nop,nop,TS val 4151189631 ecr 1749954103], length 0
18:26:57.259148 eth0  Out IP comp3134-Winter2025.ssh > 198.96.84.204.8841: Flags [P.], seq 480:716, ack 1, win 501, options [nop,nop,TS val 363185042 ecr 3355397592], length 236
18:26:57.259199 eth0  Out IP comp3134-Winter2025.ssh > 198.96.84.204.8841: Flags [P.], seq 716:752, ack 1, win 501, options [nop,nop,TS val 363185042 ecr 3355397592], length 36
18:26:57.259303 eth0  Out IP comp3134-Winter2025.ssh > 198.96.84.204.8841: Flags [P.], seq 752:964, ack 1, win 501, options [nop,nop,TS val 363185042 ecr 3355397592], length 212
18:26:57.259336 eth0  Out IP comp3134-Winter2025.ssh > 198.96.84.204.8841: Flags [P.], seq 964:1000, ack 1, win 501, options [nop,nop,TS val 363185042 ecr 3355397592], length 36
18:26:57.259388 eth0  Out IP comp3134-Winter2025.ssh > 198.96.84.204.8841: Flags [P.], seq 1000:1196, ack 1, win 501, options [nop,nop,TS val 363185042 ecr 3355397592], length 196
18:26:57.259436 eth0  Out IP comp3134-Winter2025.ssh > 198.96.84.204.8841: Flags [P.], seq 1196:1232, ack 1, win 501, options [nop,nop,TS val 363185042 ecr 3355397592], length 36
18:26:57.259494 eth0  Out IP comp3134-Winter2025.ssh > 198.96.84.204.8841: Flags [P.], seq 1232:1444, ack 1, win 501, options [nop,nop,TS val 363185042 ecr 3355397592], length 212
18:26:57.259550 eth0  Out IP comp3134-Winter2025.ssh > 198.96.84.204.8841: Flags [P.], seq 1444:1480, ack 1, win 501, options [nop,nop,TS val 363185042 ecr 3355397592], length 36
18:26:57.259574 eth0  Out IP comp3134-Winter2025.ssh > 198.96.84.204.8841: Flags [P.], seq 1480:1692, ack 1, win 501, options [nop,nop,TS val 363185042 ecr 3355397592], length 212
18:26:57.259603 eth0  Out IP comp3134-Winter2025.ssh > 198.96.84.204.8841: Flags [P.], seq 1692:1728, ack 1, win 501, options [nop,nop,TS val 363185042 ecr 3355397592], length 36
18:26:57.259653 eth0  Out IP comp3134-Winter2025.ssh > 198.96.84.204.8841: Flags [P.], seq 1728:1940, ack 1, win 501, options [nop,nop,TS val 363185043 ecr 3355397592], length 212
18:26:57.259869 eth0  Out IP comp3134-Winter2025.ssh > 198.96.84.204.8841: Flags [P.], seq 1940:1976, ack 1, win 501, options [nop,nop,TS val 363185043 ecr 3355397592], length 36
18:26:57.259969 eth0  Out IP comp3134-Winter2025.ssh > 198.96.84.204.8841: Flags [P.], seq 1976:2188, ack 1, win 501, options [nop,nop,TS val 363185043 ecr 3355397592], length 212
18:26:57.260001 eth0  Out IP comp3134-Winter2025.ssh > 198.96.84.204.8841: Flags [P.], seq 2188:2224, ack 1, win 501, options [nop,nop,TS val 363185043 ecr 3355397592], length 36
18:26:57.260074 eth0  Out IP comp3134-Winter2025.ssh > 198.96.84.204.8841: Flags [P.], seq 2224:2436, ack 1, win 501, options [nop,nop,TS val 363185043 ecr 3355397592], length 212
18:26:57.260139 eth0  Out IP comp3134-Winter2025.ssh > 198.96.84.204.8841: Flags [P.], seq 2436:2684, ack 1, win 501, options [nop,nop,TS val 363185043 ecr 3355397592], length 248
18:26:57.286710 eth0  Out IP comp3134-Winter2025.ssh > 198.96.84.204.8841: Flags [.], seq 2684:3922, ack 1, win 501, options [nop,nop,TS val 363185070 ecr 3355397592], length 1238
18:26:57.355350 eth0  Out IP comp3134-Winter2025.34730 > 67.207.67.3.domain: Flags [P.], seq 47:91, ack 112, win 502, options [nop,nop,TS val 4151189731 ecr 1749954103], length 44 64848+ PTR? 3.67.207.67.in-addr.arpa. (42)
18:26:57.357229 eth0  In  IP 67.207.67.3.domain > comp3134-Winter2025.34730: Flags [P.], seq 112:223, ack 91, win 128, options [nop,nop,TS val 1749954204 ecr 4151189731], length 111 64848 NXDomain 0/1/0 (109)
18:26:57.357262 eth0  Out IP comp3134-Winter2025.34730 > 67.207.67.3.domain: Flags [.], ack 223, win 502, options [nop,nop,TS val 4151189733 ecr 1749954204], length 0
18:26:57.388588 eth0  In  IP 198.96.84.204.8841 > comp3134-Winter2025.ssh: Flags [.], ack 716, win 1308, options [nop,nop,TS val 3355397815 ecr 363185042], length 0
18:26:57.388589 eth0  In  IP 198.96.84.204.8841 > comp3134-Winter2025.ssh: Flags [.], ack 752, win 1308, options [nop,nop,TS val 3355397815 ecr 363185042], length 0
18:26:57.388589 eth0  In  IP 198.96.84.204.8841 > comp3134-Winter2025.ssh: Flags [.], ack 964, win 1307, options [nop,nop,TS val 3355397815 ecr 363185042], length 0
18:26:57.388655 eth0  Out IP comp3134-Winter2025.ssh > 198.96.84.204.8841: Flags [.], seq 3922:5160, ack 1, win 501, options [nop,nop,TS val 363185172 ecr 3355397815], length 1238
18:26:57.388678 eth0  Out IP comp3134-Winter2025.ssh > 198.96.84.204.8841: Flags [P.], seq 5160:7636, ack 1, win 501, options [nop,nop,TS val 363185172 ecr 3355397815], length 2476
18:26:57.388688 eth0  Out IP comp3134-Winter2025.ssh > 198.96.84.204.8841: Flags [P.], seq 7636:10112, ack 1, win 501, options [nop,nop,TS val 363185172 ecr 3355397815], length 2476
18:26:57.389020 eth0  In  IP 198.96.84.204.8841 > comp3134-Winter2025.ssh: Flags [.], ack 1000, win 1307, options [nop,nop,TS val 3355397815 ecr 363185042], length 0
18:26:57.389021 eth0  In  IP 198.96.84.204.8841 > comp3134-Winter2025.ssh: Flags [.], ack 1196, win 1306, options [nop,nop,TS val 3355397815 ecr 363185042], length 0
18:26:57.389021 eth0  In  IP 198.96.84.204.8841 > comp3134-Winter2025.ssh: Flags [.], ack 1232, win 1306, options [nop,nop,TS val 3355397815 ecr 363185042], length 0
18:26:57.389021 eth0  In  IP 198.96.84.204.8841 > comp3134-Winter2025.ssh: Flags [.], ack 1444, win 1305, options [nop,nop,TS val 3355397815 ecr 363185042], length 0
18:26:57.389021 eth0  In  IP 198.96.84.204.8841 > comp3134-Winter2025.ssh: Flags [.], ack 1480, win 1305, options [nop,nop,TS val 3355397815 ecr 363185042], length 0
18:26:57.389021 eth0  In  IP 198.96.84.204.8841 > comp3134-Winter2025.ssh: Flags [.], ack 1692, win 1304, options [nop,nop,TS val 3355397815 ecr 363185042], length 0
18:26:57.389021 eth0  In  IP 198.96.84.204.8841 > comp3134-Winter2025.ssh: Flags [.], ack 1728, win 1304, options [nop,nop,TS val 3355397815 ecr 363185042], length 0
18:26:57.389021 eth0  In  IP 198.96.84.204.8841 > comp3134-Winter2025.ssh: Flags [.], ack 1940, win 1303, options [nop,nop,TS val 3355397815 ecr 363185043], length 0
18:26:57.389041 eth0  Out IP comp3134-Winter2025.ssh > 198.96.84.204.8841: Flags [P.], seq 10112:10784, ack 1, win 501, options [nop,nop,TS val 363185172 ecr 3355397815], length 672
18:26:57.389077 eth0  In  IP 198.96.84.204.8841 > comp3134-Winter2025.ssh: Flags [.], ack 1976, win 1303, options [nop,nop,TS val 3355397815 ecr 363185043], length 0
18:26:57.389077 eth0  In  IP 198.96.84.204.8841 > comp3134-Winter2025.ssh: Flags [.], ack 2188, win 1302, options [nop,nop,TS val 3355397815 ecr 363185043], length 0
18:26:57.389077 eth0  In  IP 198.96.84.204.8841 > comp3134-Winter2025.ssh: Flags [.], ack 2224, win 1302, options [nop,nop,TS val 3355397815 ecr 363185043], length 0
18:26:57.389077 eth0  In  IP 198.96.84.204.8841 > comp3134-Winter2025.ssh: Flags [.], ack 2436, win 1301, options [nop,nop,TS val 3355397815 ecr 363185043], length 0
18:26:57.389223 eth0  In  IP 198.96.84.204.8841 > comp3134-Winter2025.ssh: Flags [.], ack 2684, win 1303, options [nop,nop,TS val 3355397815 ecr 363185043], length 0
18:26:57.396854 eth0  In  IP 198.96.84.204.8841 > comp3134-Winter2025.ssh: Flags [.], ack 10784, win 1309, options [nop,nop,TS val 3355397830 ecr 363185070], length 0
18:26:57.458939 eth0  Out IP comp3134-Winter2025.ssh > 198.96.84.204.8841: Flags [P.], seq 10784:11044, ack 1, win 501, options [nop,nop,TS val 363185242 ecr 3355397830], length 260
18:26:57.459039 eth0  Out IP comp3134-Winter2025.ssh > 198.96.84.204.8841: Flags [P.], seq 11044:11324, ack 1, win 501, options [nop,nop,TS val 363185242 ecr 3355397830], length 280
18:26:57.459079 eth0  Out IP comp3134-Winter2025.ssh > 198.96.84.204.8841: Flags [P.], seq 11324:11360, ack 1, win 501, options [nop,nop,TS val 363185242 ecr 3355397830], length 36
18:26:57.459156 eth0  Out IP comp3134-Winter2025.ssh > 198.96.84.204.8841: Flags [P.], seq 11360:11564, ack 1, win 501, options [nop,nop,TS val 363185242 ecr 3355397830], length 204
18:26:57.459196 eth0  Out IP comp3134-Winter2025.ssh > 198.96.84.204.8841: Flags [P.], seq 11564:11600, ack 1, win 501, options [nop,nop,TS val 363185242 ecr 3355397830], length 36
18:26:57.459249 eth0  Out IP comp3134-Winter2025.ssh > 198.96.84.204.8841: Flags [P.], seq 11600:11804, ack 1, win 501, options [nop,nop,TS val 363185242 ecr 3355397830], length 204
18:26:57.459313 eth0  Out IP comp3134-Winter2025.ssh > 198.96.84.204.8841: Flags [P.], seq 11804:11840, ack 1, win 501, options [nop,nop,TS val 363185242 ecr 3355397830], length 36
18:26:57.459346 eth0  Out IP comp3134-Winter2025.ssh > 198.96.84.204.8841: Flags [P.], seq 11840:12044, ack 1, win 501, options [nop,nop,TS val 363185242 ecr 3355397830], length 204
18:26:57.459374 eth0  Out IP comp3134-Winter2025.ssh > 198.96.84.204.8841: Flags [P.], seq 12044:12080, ack 1, win 501, options [nop,nop,TS val 363185242 ecr 3355397830], length 36
18:26:57.459419 eth0  Out IP comp3134-Winter2025.ssh > 198.96.84.204.8841: Flags [P.], seq 12080:12284, ack 1, win 501, options [nop,nop,TS val 363185242 ecr 3355397830], length 204
18:26:57.459447 eth0  Out IP comp3134-Winter2025.ssh > 198.96.84.204.8841: Flags [P.], seq 12284:12320, ack 1, win 501, options [nop,nop,TS val 363185242 ecr 3355397830], length 36
18:26:57.459492 eth0  Out IP comp3134-Winter2025.ssh > 198.96.84.204.8841: Flags [P.], seq 12320:12540, ack 1, win 501, options [nop,nop,TS val 363185242 ecr 3355397830], length 220
18:26:57.459535 eth0  Out IP comp3134-Winter2025.ssh > 198.96.84.204.8841: Flags [P.], seq 12540:12576, ack 1, win 501, options [nop,nop,TS val 363185242 ecr 3355397830], length 36
18:26:57.459580 eth0  Out IP comp3134-Winter2025.ssh > 198.96.84.204.8841: Flags [P.], seq 12576:12796, ack 1, win 501, options [nop,nop,TS val 363185242 ecr 3355397830], length 220
18:26:57.459607 eth0  Out IP comp3134-Winter2025.ssh > 198.96.84.204.8841: Flags [P.], seq 12796:12832, ack 1, win 501, options [nop,nop,TS val 363185242 ecr 3355397830], length 36
18:26:57.459663 eth0  Out IP comp3134-Winter2025.ssh > 198.96.84.204.8841: Flags [P.], seq 12832:13052, ack 1, win 501, options [nop,nop,TS val 363185243 ecr 3355397830], length 220
18:26:57.459690 eth0  Out IP comp3134-Winter2025.ssh > 198.96.84.204.8841: Flags [P.], seq 13052:13088, ack 1, win 501, options [nop,nop,TS val 363185243 ecr 3355397830], length 36
18:26:57.459975 eth0  Out IP comp3134-Winter2025.ssh > 198.96.84.204.8841: Flags [P.], seq 13088:13292, ack 1, win 501, options [nop,nop,TS val 363185243 ecr 3355397830], length 204
18:26:57.460109 eth0  Out IP comp3134-Winter2025.ssh > 198.96.84.204.8841: Flags [P.], seq 13292:13532, ack 1, win 501, options [nop,nop,TS val 363185243 ecr 3355397830], length 240
18:26:57.460162 eth0  Out IP comp3134-Winter2025.ssh > 198.96.84.204.8841: Flags [P.], seq 13532:13568, ack 1, win 501, options [nop,nop,TS val 363185243 ecr 3355397830], length 36
18:26:57.460245 eth0  Out IP comp3134-Winter2025.ssh > 198.96.84.204.8841: Flags [P.], seq 13568:13772, ack 1, win 501, options [nop,nop,TS val 363185243 ecr 3355397830], length 204
18:26:57.460283 eth0  Out IP comp3134-Winter2025.ssh > 198.96.84.204.8841: Flags [P.], seq 13772:13808, ack 1, win 501, options [nop,nop,TS val 363185243 ecr 3355397830], length 36
18:26:57.460345 eth0  Out IP comp3134-Winter2025.ssh > 198.96.84.204.8841: Flags [P.], seq 13808:14012, ack 1, win 501, options [nop,nop,TS val 363185243 ecr 3355397830], length 204
18:26:57.460405 eth0  Out IP comp3134-Winter2025.ssh > 198.96.84.204.8841: Flags [P.], seq 14012:14252, ack 1, win 501, options [nop,nop,TS val 363185243 ecr 3355397830], length 240
18:26:57.460446 eth0  Out IP comp3134-Winter2025.ssh > 198.96.84.204.8841: Flags [P.], seq 14252:14288, ack 1, win 501, options [nop,nop,TS val 363185243 ecr 3355397830], length 36
18:26:57.460485 eth0  Out IP comp3134-Winter2025.ssh > 198.96.84.204.8841: Flags [P.], seq 14288:14492, ack 1, win 501, options [nop,nop,TS val 363185243 ecr 3355397830], length 204
18:26:57.460513 eth0  Out IP comp3134-Winter2025.ssh > 198.96.84.204.8841: Flags [P.], seq 14492:14528, ack 1, win 501, options [nop,nop,TS val 363185243 ecr 3355397830], length 36
18:26:57.460560 eth0  Out IP comp3134-Winter2025.ssh > 198.96.84.204.8841: Flags [P.], seq 14528:14732, ack 1, win 501, options [nop,nop,TS val 363185243 ecr 3355397830], length 204
18:26:57.460618 eth0  Out IP comp3134-Winter2025.ssh > 198.96.84.204.8841: Flags [P.], seq 14732:14972, ack 1, win 501, options [nop,nop,TS val 363185243 ecr 3355397830], length 240
18:26:57.460649 eth0  Out IP comp3134-Winter2025.ssh > 198.96.84.204.8841: Flags [P.], seq 14972:15008, ack 1, win 501, options [nop,nop,TS val 363185244 ecr 3355397830], length 36
18:26:57.460718 eth0  Out IP comp3134-Winter2025.ssh > 198.96.84.204.8841: Flags [P.], seq 15008:15228, ack 1, win 501, options [nop,nop,TS val 363185244 ecr 3355397830], length 220
18:26:57.460759 eth0  Out IP comp3134-Winter2025.ssh > 198.96.84.204.8841: Flags [P.], seq 15228:15264, ack 1, win 501, options [nop,nop,TS val 363185244 ecr 3355397830], length 36
18:26:57.460818 eth0  Out IP comp3134-Winter2025.ssh > 198.96.84.204.8841: Flags [P.], seq 15264:15468, ack 1, win 501, options [nop,nop,TS val 363185244 ecr 3355397830], length 204
18:26:57.460863 eth0  Out IP comp3134-Winter2025.ssh > 198.96.84.204.8841: Flags [P.], seq 15468:15504, ack 1, win 501, options [nop,nop,TS val 363185244 ecr 3355397830], length 36
18:26:57.460899 eth0  Out IP comp3134-Winter2025.ssh > 198.96.84.204.8841: Flags [P.], seq 15504:15708, ack 1, win 501, options [nop,nop,TS val 363185244 ecr 3355397830], length 204
18:26:57.460927 eth0  Out IP comp3134-Winter2025.ssh > 198.96.84.204.8841: Flags [P.], seq 15708:15744, ack 1, win 501, options [nop,nop,TS val 363185244 ecr 3355397830], length 36
18:26:57.460972 eth0  Out IP comp3134-Winter2025.ssh > 198.96.84.204.8841: Flags [P.], seq 15744:15948, ack 1, win 501, options [nop,nop,TS val 363185244 ecr 3355397830], length 204
18:26:57.460999 eth0  Out IP comp3134-Winter2025.ssh > 198.96.84.204.8841: Flags [P.], seq 15948:15984, ack 1, win 501, options [nop,nop,TS val 363185244 ecr 3355397830], length 36
18:26:57.461044 eth0  Out IP comp3134-Winter2025.ssh > 198.96.84.204.8841: Flags [P.], seq 15984:16188, ack 1, win 501, options [nop,nop,TS val 363185244 ecr 3355397830], length 204
18:26:57.463355 eth0  In  IP 198.96.84.204.8841 > comp3134-Winter2025.ssh: Flags [.], ack 12576, win 1309, options [nop,nop,TS val 3355397898 ecr 363185242], length 0
18:26:57.463407 eth0  Out IP comp3134-Winter2025.ssh > 198.96.84.204.8841: Flags [P.], seq 16188:16704, ack 1, win 501, options [nop,nop,TS val 363185246 ecr 3355397898], length 516
18:26:57.465138 eth0  In  IP 198.96.84.204.8841 > comp3134-Winter2025.ssh: Flags [.], ack 13088, win 1309, options [nop,nop,TS val 3355397898 ecr 363185242], length 0
18:26:57.465138 eth0  In  IP 198.96.84.204.8841 > comp3134-Winter2025.ssh: Flags [.], ack 16188, win 1309, options [nop,nop,TS val 3355397900 ecr 363185243], length 0
18:26:57.470227 eth0  In  IP 198.96.84.204.8841 > comp3134-Winter2025.ssh: Flags [.], ack 16704, win 1309, options [nop,nop,TS val 3355397905 ecr 363185246], length 0
18:26:57.505866 eth0  In  IP 112.133.210.27.51788 > comp3134-Winter2025.ssh: Flags [S], seq 2646463425, win 32120, options [mss 1460,sackOK,TS val 339591744 ecr 0,nop,wscale 7], length 0
18:26:57.562909 eth0  Out IP comp3134-Winter2025.ssh > 198.96.84.204.8841: Flags [P.], seq 16704:16924, ack 1, win 501, options [nop,nop,TS val 363185346 ecr 3355397905], length 220
18:26:57.562998 eth0  Out IP comp3134-Winter2025.ssh > 198.96.84.204.8841: Flags [P.], seq 16924:17180, ack 1, win 501, options [nop,nop,TS val 363185346 ecr 3355397905], length 256
18:26:57.563032 eth0  Out IP comp3134-Winter2025.ssh > 198.96.84.204.8841: Flags [P.], seq 17180:17216, ack 1, win 501, options [nop,nop,TS val 363185346 ecr 3355397905], length 36
18:26:57.563083 eth0  Out IP comp3134-Winter2025.ssh > 198.96.84.204.8841: Flags [P.], seq 17216:17436, ack 1, win 501, options [nop,nop,TS val 363185346 ecr 3355397905], length 220
18:26:57.563112 eth0  Out IP comp3134-Winter2025.ssh > 198.96.84.204.8841: Flags [P.], seq 17436:17472, ack 1, win 501, options [nop,nop,TS val 363185346 ecr 3355397905], length 36
18:26:57.563171 eth0  Out IP comp3134-Winter2025.ssh > 198.96.84.204.8841: Flags [P.], seq 17472:17692, ack 1, win 501, options [nop,nop,TS val 363185346 ecr 3355397905], length 220
18:26:57.563205 eth0  Out IP comp3134-Winter2025.ssh > 198.96.84.204.8841: Flags [P.], seq 17692:17728, ack 1, win 501, options [nop,nop,TS val 363185346 ecr 3355397905], length 36
18:26:57.563249 eth0  Out IP comp3134-Winter2025.ssh > 198.96.84.204.8841: Flags [P.], seq 17728:17948, ack 1, win 501, options [nop,nop,TS val 363185346 ecr 3355397905], length 220
18:26:57.563278 eth0  Out IP comp3134-Winter2025.ssh > 198.96.84.204.8841: Flags [P.], seq 17948:17984, ack 1, win 501, options [nop,nop,TS val 363185346 ecr 3355397905], length 36
18:26:57.563323 eth0  Out IP comp3134-Winter2025.ssh > 198.96.84.204.8841: Flags [P.], seq 17984:18204, ack 1, win 501, options [nop,nop,TS val 363185346 ecr 3355397905], length 220
18:26:57.563350 eth0  Out IP comp3134-Winter2025.ssh > 198.96.84.204.8841: Flags [P.], seq 18204:18240, ack 1, win 501, options [nop,nop,TS val 363185346 ecr 3355397905], length 36
18:26:57.563394 eth0  Out IP comp3134-Winter2025.ssh > 198.96.84.204.8841: Flags [P.], seq 18240:18460, ack 1, win 501, options [nop,nop,TS val 363185346 ecr 3355397905], length 220
18:26:57.563453 eth0  Out IP comp3134-Winter2025.ssh > 198.96.84.204.8841: Flags [P.], seq 18460:18716, ack 1, win 501, options [nop,nop,TS val 363185346 ecr 3355397905], length 256
18:26:57.563493 eth0  Out IP comp3134-Winter2025.ssh > 198.96.84.204.8841: Flags [P.], seq 18716:18752, ack 1, win 501, options [nop,nop,TS val 363185346 ecr 3355397905], length 36
18:26:57.563533 eth0  Out IP comp3134-Winter2025.ssh > 198.96.84.204.8841: Flags [P.], seq 18752:18972, ack 1, win 501, options [nop,nop,TS val 363185346 ecr 3355397905], length 220
18:26:57.563561 eth0  Out IP comp3134-Winter2025.ssh > 198.96.84.204.8841: Flags [P.], seq 18972:19008, ack 1, win 501, options [nop,nop,TS val 363185346 ecr 3355397905], length 36
18:26:57.563606 eth0  Out IP comp3134-Winter2025.ssh > 198.96.84.204.8841: Flags [P.], seq 19008:19228, ack 1, win 501, options [nop,nop,TS val 363185346 ecr 3355397905], length 220
18:26:57.563633 eth0  Out IP comp3134-Winter2025.ssh > 198.96.84.204.8841: Flags [P.], seq 19228:19264, ack 1, win 501, options [nop,nop,TS val 363185347 ecr 3355397905], length 36
18:26:57.563676 eth0  Out IP comp3134-Winter2025.ssh > 198.96.84.204.8841: Flags [P.], seq 19264:19484, ack 1, win 501, options [nop,nop,TS val 363185347 ecr 3355397905], length 220
18:26:57.563852 eth0  Out IP comp3134-Winter2025.ssh > 198.96.84.204.8841: Flags [P.], seq 19484:19520, ack 1, win 501, options [nop,nop,TS val 363185347 ecr 3355397905], length 36
18:26:57.563949 eth0  Out IP comp3134-Winter2025.ssh > 198.96.84.204.8841: Flags [P.], seq 19520:19740, ack 1, win 501, options [nop,nop,TS val 363185347 ecr 3355397905], length 220
18:26:57.563979 eth0  Out IP comp3134-Winter2025.ssh > 198.96.84.204.8841: Flags [P.], seq 19740:19776, ack 1, win 501, options [nop,nop,TS val 363185347 ecr 3355397905], length 36
18:26:57.564025 eth0  Out IP comp3134-Winter2025.ssh > 198.96.84.204.8841: Flags [P.], seq 19776:19996, ack 1, win 501, options [nop,nop,TS val 363185347 ecr 3355397905], length 220
18:26:57.564073 eth0  Out IP comp3134-Winter2025.ssh > 198.96.84.204.8841: Flags [P.], seq 19996:20032, ack 1, win 501, options [nop,nop,TS val 363185347 ecr 3355397905], length 36
18:26:57.564109 eth0  Out IP comp3134-Winter2025.ssh > 198.96.84.204.8841: Flags [P.], seq 20032:20252, ack 1, win 501, options [nop,nop,TS val 363185347 ecr 3355397905], length 220
18:26:57.564137 eth0  Out IP comp3134-Winter2025.ssh > 198.96.84.204.8841: Flags [P.], seq 20252:20288, ack 1, win 501, options [nop,nop,TS val 363185347 ecr 3355397905], length 36
18:26:57.564181 eth0  Out IP comp3134-Winter2025.ssh > 198.96.84.204.8841: Flags [P.], seq 20288:20508, ack 1, win 501, options [nop,nop,TS val 363185347 ecr 3355397905], length 220
18:26:57.564208 eth0  Out IP comp3134-Winter2025.ssh > 198.96.84.204.8841: Flags [P.], seq 20508:20544, ack 1, win 501, options [nop,nop,TS val 363185347 ecr 3355397905], length 36
18:26:57.564252 eth0  Out IP comp3134-Winter2025.ssh > 198.96.84.204.8841: Flags [P.], seq 20544:20764, ack 1, win 501, options [nop,nop,TS val 363185347 ecr 3355397905], length 220
18:26:57.564279 eth0  Out IP comp3134-Winter2025.ssh > 198.96.84.204.8841: Flags [P.], seq 20764:20800, ack 1, win 501, options [nop,nop,TS val 363185347 ecr 3355397905], length 36
18:26:57.564324 eth0  Out IP comp3134-Winter2025.ssh > 198.96.84.204.8841: Flags [P.], seq 20800:21020, ack 1, win 501, options [nop,nop,TS val 363185347 ecr 3355397905], length 220
18:26:57.564352 eth0  Out IP comp3134-Winter2025.ssh > 198.96.84.204.8841: Flags [P.], seq 21020:21056, ack 1, win 501, options [nop,nop,TS val 363185347 ecr 3355397905], length 36
18:26:57.564397 eth0  Out IP comp3134-Winter2025.ssh > 198.96.84.204.8841: Flags [P.], seq 21056:21276, ack 1, win 501, options [nop,nop,TS val 363185347 ecr 3355397905], length 220
18:26:57.564424 eth0  Out IP comp3134-Winter2025.ssh > 198.96.84.204.8841: Flags [P.], seq 21276:21312, ack 1, win 501, options [nop,nop,TS val 363185347 ecr 3355397905], length 36
18:26:57.564468 eth0  Out IP comp3134-Winter2025.ssh > 198.96.84.204.8841: Flags [P.], seq 21312:21532, ack 1, win 501, options [nop,nop,TS val 363185347 ecr 3355397905], length 220
18:26:57.564495 eth0  Out IP comp3134-Winter2025.ssh > 198.96.84.204.8841: Flags [P.], seq 21532:21568, ack 1, win 501, options [nop,nop,TS val 363185347 ecr 3355397905], length 36
18:26:57.564539 eth0  Out IP comp3134-Winter2025.ssh > 198.96.84.204.8841: Flags [P.], seq 21568:21788, ack 1, win 501, options [nop,nop,TS val 363185347 ecr 3355397905], length 220
18:26:57.564567 eth0  Out IP comp3134-Winter2025.ssh > 198.96.84.204.8841: Flags [P.], seq 21788:21824, ack 1, win 501, options [nop,nop,TS val 363185347 ecr 3355397905], length 36
18:26:57.564611 eth0  Out IP comp3134-Winter2025.ssh > 198.96.84.204.8841: Flags [P.], seq 21824:22044, ack 1, win 501, options [nop,nop,TS val 363185347 ecr 3355397905], length 220
18:26:57.564639 eth0  Out IP comp3134-Winter2025.ssh > 198.96.84.204.8841: Flags [P.], seq 22044:22080, ack 1, win 501, options [nop,nop,TS val 363185348 ecr 3355397905], length 36
18:26:57.564686 eth0  Out IP comp3134-Winter2025.ssh > 198.96.84.204.8841: Flags [P.], seq 22080:22300, ack 1, win 501, options [nop,nop,TS val 363185348 ecr 3355397905], length 220
18:26:57.564713 eth0  Out IP comp3134-Winter2025.ssh > 198.96.84.204.8841: Flags [P.], seq 22300:22336, ack 1, win 501, options [nop,nop,TS val 363185348 ecr 3355397905], length 36
18:26:57.564758 eth0  Out IP comp3134-Winter2025.ssh > 198.96.84.204.8841: Flags [P.], seq 22336:22556, ack 1, win 501, options [nop,nop,TS val 363185348 ecr 3355397905], length 220
18:26:57.564786 eth0  Out IP comp3134-Winter2025.ssh > 198.96.84.204.8841: Flags [P.], seq 22556:22592, ack 1, win 501, options [nop,nop,TS val 363185348 ecr 3355397905], length 36
18:26:57.564845 eth0  Out IP comp3134-Winter2025.ssh > 198.96.84.204.8841: Flags [P.], seq 22592:22812, ack 1, win 501, options [nop,nop,TS val 363185348 ecr 3355397905], length 220
18:26:57.564872 eth0  Out IP comp3134-Winter2025.ssh > 198.96.84.204.8841: Flags [P.], seq 22812:22848, ack 1, win 501, options [nop,nop,TS val 363185348 ecr 3355397905], length 36
18:26:57.564917 eth0  Out IP comp3134-Winter2025.ssh > 198.96.84.204.8841: Flags [P.], seq 22848:23068, ack 1, win 501, options [nop,nop,TS val 363185348 ecr 3355397905], length 220
18:26:57.564951 eth0  Out IP comp3134-Winter2025.ssh > 198.96.84.204.8841: Flags [P.], seq 23068:23104, ack 1, win 501, options [nop,nop,TS val 363185348 ecr 3355397905], length 36
18:26:57.564996 eth0  Out IP comp3134-Winter2025.ssh > 198.96.84.204.8841: Flags [P.], seq 23104:23324, ack 1, win 501, options [nop,nop,TS val 363185348 ecr 3355397905], length 220
18:26:57.565023 eth0  Out IP comp3134-Winter2025.ssh > 198.96.84.204.8841: Flags [P.], seq 23324:23360, ack 1, win 501, options [nop,nop,TS val 363185348 ecr 3355397905], length 36
18:26:57.565067 eth0  Out IP comp3134-Winter2025.ssh > 198.96.84.204.8841: Flags [P.], seq 23360:23580, ack 1, win 501, options [nop,nop,TS val 363185348 ecr 3355397905], length 220
18:26:57.565094 eth0  Out IP comp3134-Winter2025.ssh > 198.96.84.204.8841: Flags [P.], seq 23580:23616, ack 1, win 501, options [nop,nop,TS val 363185348 ecr 3355397905], length 36
18:26:57.565151 eth0  Out IP comp3134-Winter2025.ssh > 198.96.84.204.8841: Flags [P.], seq 23616:23836, ack 1, win 501, options [nop,nop,TS val 363185348 ecr 3355397905], length 220
18:26:57.565181 eth0  Out IP comp3134-Winter2025.ssh > 198.96.84.204.8841: Flags [P.], seq 23836:23872, ack 1, win 501, options [nop,nop,TS val 363185348 ecr 3355397905], length 36
18:26:57.565234 eth0  Out IP comp3134-Winter2025.ssh > 198.96.84.204.8841: Flags [P.], seq 23872:24092, ack 1, win 501, options [nop,nop,TS val 363185348 ecr 3355397905], length 220
18:26:57.565275 eth0  Out IP comp3134-Winter2025.ssh > 198.96.84.204.8841: Flags [P.], seq 24092:24128, ack 1, win 501, options [nop,nop,TS val 363185348 ecr 3355397905], length 36
18:26:57.565325 eth0  Out IP comp3134-Winter2025.ssh > 198.96.84.204.8841: Flags [P.], seq 24128:24348, ack 1, win 501, options [nop,nop,TS val 363185348 ecr 3355397905], length 220
18:26:57.565354 eth0  Out IP comp3134-Winter2025.ssh > 198.96.84.204.8841: Flags [P.], seq 24348:24384, ack 1, win 501, options [nop,nop,TS val 363185348 ecr 3355397905], length 36
18:26:57.565401 eth0  Out IP comp3134-Winter2025.ssh > 198.96.84.204.8841: Flags [P.], seq 24384:24604, ack 1, win 501, options [nop,nop,TS val 363185348 ecr 3355397905], length 220
18:26:57.565428 eth0  Out IP comp3134-Winter2025.ssh > 198.96.84.204.8841: Flags [P.], seq 24604:24640, ack 1, win 501, options [nop,nop,TS val 363185348 ecr 3355397905], length 36
18:26:57.565473 eth0  Out IP comp3134-Winter2025.ssh > 198.96.84.204.8841: Flags [P.], seq 24640:24860, ack 1, win 501, options [nop,nop,TS val 363185348 ecr 3355397905], length 220
18:26:57.565504 eth0  Out IP comp3134-Winter2025.ssh > 198.96.84.204.8841: Flags [P.], seq 24860:24896, ack 1, win 501, options [nop,nop,TS val 363185348 ecr 3355397905], length 36
18:26:57.565556 eth0  Out IP comp3134-Winter2025.ssh > 198.96.84.204.8841: Flags [P.], seq 24896:25116, ack 1, win 501, options [nop,nop,TS val 363185348 ecr 3355397905], length 220
18:26:57.565587 eth0  Out IP comp3134-Winter2025.ssh > 198.96.84.204.8841: Flags [P.], seq 25116:25152, ack 1, win 501, options [nop,nop,TS val 363185348 ecr 3355397905], length 36
18:26:57.565632 eth0  Out IP comp3134-Winter2025.ssh > 198.96.84.204.8841: Flags [P.], seq 25152:25372, ack 1, win 501, options [nop,nop,TS val 363185349 ecr 3355397905], length 220
18:26:57.565659 eth0  Out IP comp3134-Winter2025.ssh > 198.96.84.204.8841: Flags [P.], seq 25372:25408, ack 1, win 501, options [nop,nop,TS val 363185349 ecr 3355397905], length 36
18:26:57.566862 eth0  Out IP comp3134-Winter2025.34730 > 67.207.67.3.domain: Flags [P.], seq 91:138, ack 223, win 502, options [nop,nop,TS val 4151189943 ecr 1749954204], length 47 28692+ PTR? 27.210.133.112.in-addr.arpa. (45)
18:26:57.568103 eth0  In  IP 67.207.67.3.domain > comp3134-Winter2025.34730: Flags [P.], seq 223:327, ack 138, win 128, options [nop,nop,TS val 1749954415 ecr 4151189943], length 104 28692 NXDomain 0/1/0 (102)
18:26:57.568168 eth0  Out IP comp3134-Winter2025.34730 > 67.207.67.3.domain: Flags [.], ack 327, win 502, options [nop,nop,TS val 4151189944 ecr 1749954415], length 0
18:26:57.571848 eth0  In  IP 198.96.84.204.8841 > comp3134-Winter2025.ssh: Flags [.], ack 20508, win 1295, options [nop,nop,TS val 3355398003 ecr 363185346], length 0
18:26:57.571849 eth0  In  IP 198.96.84.204.8841 > comp3134-Winter2025.ssh: Flags [.], ack 21056, win 1309, options [nop,nop,TS val 3355398003 ecr 363185347], length 0
18:26:57.571849 eth0  In  IP 198.96.84.204.8841 > comp3134-Winter2025.ssh: Flags [.], ack 23324, win 1309, options [nop,nop,TS val 3355398003 ecr 363185347], length 0
18:26:57.571849 eth0  In  IP 198.96.84.204.8841 > comp3134-Winter2025.ssh: Flags [.], ack 25408, win 1309, options [nop,nop,TS val 3355398004 ecr 363185348], length 0
18:26:57.571919 eth0  Out IP comp3134-Winter2025.ssh > 198.96.84.204.8841: Flags [P.], seq 25408:27884, ack 1, win 501, options [nop,nop,TS val 363185355 ecr 3355398003], length 2476
18:26:57.572069 eth0  Out IP comp3134-Winter2025.ssh > 198.96.84.204.8841: Flags [P.], seq 27884:28160, ack 1, win 501, options [nop,nop,TS val 363185355 ecr 3355398004], length 276
18:26:57.576479 eth0  In  IP 198.96.84.204.8841 > comp3134-Winter2025.ssh: Flags [.], ack 28160, win 1309, options [nop,nop,TS val 3355398011 ecr 363185355], length 0
18:26:57.666956 eth0  Out IP comp3134-Winter2025.ssh > 198.96.84.204.8841: Flags [P.], seq 28160:28380, ack 1, win 501, options [nop,nop,TS val 363185450 ecr 3355398011], length 220
18:26:57.667023 eth0  Out IP comp3134-Winter2025.ssh > 198.96.84.204.8841: Flags [P.], seq 28380:28416, ack 1, win 501, options [nop,nop,TS val 363185450 ecr 3355398011], length 36
18:26:57.667085 eth0  Out IP comp3134-Winter2025.ssh > 198.96.84.204.8841: Flags [P.], seq 28416:28636, ack 1, win 501, options [nop,nop,TS val 363185450 ecr 3355398011], length 220
18:26:57.667150 eth0  Out IP comp3134-Winter2025.ssh > 198.96.84.204.8841: Flags [P.], seq 28636:28892, ack 1, win 501, options [nop,nop,TS val 363185450 ecr 3355398011], length 256
18:26:57.667208 eth0  Out IP comp3134-Winter2025.ssh > 198.96.84.204.8841: Flags [P.], seq 28892:28928, ack 1, win 501, options [nop,nop,TS val 363185450 ecr 3355398011], length 36
18:26:57.667242 eth0  Out IP comp3134-Winter2025.ssh > 198.96.84.204.8841: Flags [P.], seq 28928:29148, ack 1, win 501, options [nop,nop,TS val 363185450 ecr 3355398011], length 220
18:26:57.667274 eth0  Out IP comp3134-Winter2025.ssh > 198.96.84.204.8841: Flags [P.], seq 29148:29184, ack 1, win 501, options [nop,nop,TS val 363185450 ecr 3355398011], length 36
18:26:57.667328 eth0  Out IP comp3134-Winter2025.ssh > 198.96.84.204.8841: Flags [P.], seq 29184:29404, ack 1, win 501, options [nop,nop,TS val 363185450 ecr 3355398011], length 220
18:26:57.667362 eth0  Out IP comp3134-Winter2025.ssh > 198.96.84.204.8841: Flags [P.], seq 29404:29440, ack 1, win 501, options [nop,nop,TS val 363185450 ecr 3355398011], length 36
18:26:57.667417 eth0  Out IP comp3134-Winter2025.ssh > 198.96.84.204.8841: Flags [P.], seq 29440:29660, ack 1, win 501, options [nop,nop,TS val 363185450 ecr 3355398011], length 220
18:26:57.667453 eth0  Out IP comp3134-Winter2025.ssh > 198.96.84.204.8841: Flags [P.], seq 29660:29696, ack 1, win 501, options [nop,nop,TS val 363185450 ecr 3355398011], length 36
18:26:57.667508 eth0  Out IP comp3134-Winter2025.ssh > 198.96.84.204.8841: Flags [P.], seq 29696:29916, ack 1, win 501, options [nop,nop,TS val 363185450 ecr 3355398011], length 220
18:26:57.667543 eth0  Out IP comp3134-Winter2025.ssh > 198.96.84.204.8841: Flags [P.], seq 29916:29952, ack 1, win 501, options [nop,nop,TS val 363185450 ecr 3355398011], length 36
18:26:57.667607 eth0  Out IP comp3134-Winter2025.ssh > 198.96.84.204.8841: Flags [P.], seq 29952:30172, ack 1, win 501, options [nop,nop,TS val 363185450 ecr 3355398011], length 220
18:26:57.667642 eth0  Out IP comp3134-Winter2025.ssh > 198.96.84.204.8841: Flags [P.], seq 30172:30208, ack 1, win 501, options [nop,nop,TS val 363185451 ecr 3355398011], length 36
18:26:57.667845 eth0  Out IP comp3134-Winter2025.ssh > 198.96.84.204.8841: Flags [P.], seq 30208:30428, ack 1, win 501, options [nop,nop,TS val 363185451 ecr 3355398011], length 220
18:26:57.667911 eth0  Out IP comp3134-Winter2025.ssh > 198.96.84.204.8841: Flags [P.], seq 30428:30464, ack 1, win 501, options [nop,nop,TS val 363185451 ecr 3355398011], length 36
18:26:57.667989 eth0  Out IP comp3134-Winter2025.ssh > 198.96.84.204.8841: Flags [P.], seq 30464:30684, ack 1, win 501, options [nop,nop,TS val 363185451 ecr 3355398011], length 220
18:26:57.668026 eth0  Out IP comp3134-Winter2025.ssh > 198.96.84.204.8841: Flags [P.], seq 30684:30720, ack 1, win 501, options [nop,nop,TS val 363185451 ecr 3355398011], length 36
18:26:57.668132 eth0  Out IP comp3134-Winter2025.ssh > 198.96.84.204.8841: Flags [P.], seq 30720:30940, ack 1, win 501, options [nop,nop,TS val 363185451 ecr 3355398011], length 220
18:26:57.668171 eth0  Out IP comp3134-Winter2025.ssh > 198.96.84.204.8841: Flags [P.], seq 30940:30976, ack 1, win 501, options [nop,nop,TS val 363185451 ecr 3355398011], length 36
18:26:57.668221 eth0  Out IP comp3134-Winter2025.ssh > 198.96.84.204.8841: Flags [P.], seq 30976:31196, ack 1, win 501, options [nop,nop,TS val 363185451 ecr 3355398011], length 220
18:26:57.668264 eth0  Out IP comp3134-Winter2025.ssh > 198.96.84.204.8841: Flags [P.], seq 31196:31232, ack 1, win 501, options [nop,nop,TS val 363185451 ecr 3355398011], length 36
18:26:57.668321 eth0  Out IP comp3134-Winter2025.ssh > 198.96.84.204.8841: Flags [P.], seq 31232:31452, ack 1, win 501, options [nop,nop,TS val 363185451 ecr 3355398011], length 220
18:26:57.668366 eth0  Out IP comp3134-Winter2025.ssh > 198.96.84.204.8841: Flags [P.], seq 31452:31488, ack 1, win 501, options [nop,nop,TS val 363185451 ecr 3355398011], length 36
18:26:57.668434 eth0  Out IP comp3134-Winter2025.ssh > 198.96.84.204.8841: Flags [P.], seq 31488:31708, ack 1, win 501, options [nop,nop,TS val 363185451 ecr 3355398011], length 220
18:26:57.668469 eth0  Out IP comp3134-Winter2025.ssh > 198.96.84.204.8841: Flags [P.], seq 31708:31744, ack 1, win 501, options [nop,nop,TS val 363185451 ecr 3355398011], length 36
18:26:57.668527 eth0  Out IP comp3134-Winter2025.ssh > 198.96.84.204.8841: Flags [P.], seq 31744:31964, ack 1, win 501, options [nop,nop,TS val 363185451 ecr 3355398011], length 220
18:26:57.668562 eth0  Out IP comp3134-Winter2025.ssh > 198.96.84.204.8841: Flags [P.], seq 31964:32000, ack 1, win 501, options [nop,nop,TS val 363185451 ecr 3355398011], length 36
18:26:57.668615 eth0  Out IP comp3134-Winter2025.ssh > 198.96.84.204.8841: Flags [P.], seq 32000:32220, ack 1, win 501, options [nop,nop,TS val 363185451 ecr 3355398011], length 220
18:26:57.668648 eth0  Out IP comp3134-Winter2025.ssh > 198.96.84.204.8841: Flags [P.], seq 32220:32256, ack 1, win 501, options [nop,nop,TS val 363185452 ecr 3355398011], length 36
18:26:57.668703 eth0  Out IP comp3134-Winter2025.ssh > 198.96.84.204.8841: Flags [P.], seq 32256:32476, ack 1, win 501, options [nop,nop,TS val 363185452 ecr 3355398011], length 220
18:26:57.668739 eth0  Out IP comp3134-Winter2025.ssh > 198.96.84.204.8841: Flags [P.], seq 32476:32512, ack 1, win 501, options [nop,nop,TS val 363185452 ecr 3355398011], length 36
18:26:57.668793 eth0  Out IP comp3134-Winter2025.ssh > 198.96.84.204.8841: Flags [P.], seq 32512:32732, ack 1, win 501, options [nop,nop,TS val 363185452 ecr 3355398011], length 220
18:26:57.668830 eth0  Out IP comp3134-Winter2025.ssh > 198.96.84.204.8841: Flags [P.], seq 32732:32768, ack 1, win 501, options [nop,nop,TS val 363185452 ecr 3355398011], length 36
