root@comp3134-Winter2025:~# tcpdump -i any '(tcp or udp)'
tcpdump: data link type LINUX_SLL2
tcpdump: verbose output suppressed, use -v[v]... for full protocol decode
listening on any, link-type LINUX_SLL2 (Linux cooked v2), snapshot length 262144 bytes
18:24:04.851775 eth0  Out IP comp3134-Winter2025.ssh > 198.96.84.204.8841: Flags [P.], seq 3701515367:3701515435, ack 3362591900, win 501, options [nop,nop,TS val 363012635 ecr 3355225281], length 68
18:24:04.852051 eth0  Out IP comp3134-Winter2025.ssh > 198.96.84.204.8841: Flags [P.], seq 68:104, ack 1, win 501, options [nop,nop,TS val 363012635 ecr 3355225281], length 36
18:24:04.854278 eth0  Out IP comp3134-Winter2025.ssh > 198.96.84.204.8841: Flags [P.], seq 104:212, ack 1, win 501, options [nop,nop,TS val 363012637 ecr 3355225281], length 108
18:24:04.854379 eth0  Out IP comp3134-Winter2025.ssh > 198.96.84.204.8841: Flags [P.], seq 212:376, ack 1, win 501, options [nop,nop,TS val 363012637 ecr 3355225281], length 164
18:24:04.854468 eth0  Out IP comp3134-Winter2025.ssh > 198.96.84.204.8841: Flags [P.], seq 376:480, ack 1, win 501, options [nop,nop,TS val 363012637 ecr 3355225281], length 104
18:24:04.855529 eth0  In  IP 198.96.84.204.8841 > comp3134-Winter2025.ssh: Flags [.], ack 0, win 373, options [nop,nop,TS val 3355225291 ecr 363012634], length 0
18:24:04.856228 eth0  In  IP 198.96.84.204.8841 > comp3134-Winter2025.ssh: Flags [.], ack 68, win 373, options [nop,nop,TS val 3355225292 ecr 363012635], length 0
18:24:04.856228 eth0  In  IP 198.96.84.204.8841 > comp3134-Winter2025.ssh: Flags [.], ack 104, win 373, options [nop,nop,TS val 3355225292 ecr 363012635], length 0
18:24:04.858008 eth0  In  IP 198.96.84.204.8841 > comp3134-Winter2025.ssh: Flags [.], ack 212, win 373, options [nop,nop,TS val 3355225294 ecr 363012637], length 0
18:24:04.858008 eth0  In  IP 198.96.84.204.8841 > comp3134-Winter2025.ssh: Flags [.], ack 376, win 372, options [nop,nop,TS val 3355225294 ecr 363012637], length 0
18:24:04.858912 eth0  In  IP 198.96.84.204.8841 > comp3134-Winter2025.ssh: Flags [.], ack 480, win 372, options [nop,nop,TS val 3355225294 ecr 363012637], length 0
18:24:04.904398 eth0  In  IP recyber.net.52347 > comp3134-Winter2025.5766: Flags [S], seq 2014256634, win 1024, length 0
18:24:04.955086 lo    In  IP localhost.50261 > localhost.domain: 55078+ [1au] PTR? 204.84.96.198.in-addr.arpa. (55)
18:24:04.955538 eth0  Out IP comp3134-Winter2025.37761 > 67.207.67.2.domain: 59798+ [1au] PTR? 204.84.96.198.in-addr.arpa. (55)
18:24:04.955640 eth0  Out IP comp3134-Winter2025.39526 > 67.207.67.2.domain: 40349+ [1au] PTR? 204.84.96.198.in-addr.arpa. (55)
18:24:04.955880 eth0  Out IP comp3134-Winter2025.45074 > 67.207.67.3.domain: Flags [S], seq 816585407, win 64240, options [mss 1460,sackOK,TS val 4151017332 ecr 0,nop,wscale 7,tfo  cookiereq,nop,nop], length 0
18:24:04.958329 eth0  In  IP 67.207.67.3.domain > comp3134-Winter2025.45074: Flags [S.], seq 521038328, ack 816585408, win 65160, options [mss 1460,sackOK,TS val 1749781805 ecr 4151017332,nop,wscale 9], length 0
18:24:04.958390 eth0  Out IP comp3134-Winter2025.45074 > 67.207.67.3.domain: Flags [.], ack 1, win 502, options [nop,nop,TS val 4151017334 ecr 1749781805], length 0
18:24:04.958453 eth0  Out IP comp3134-Winter2025.45074 > 67.207.67.3.domain: Flags [P.], seq 1:47, ack 1, win 502, options [nop,nop,TS val 4151017334 ecr 1749781805], length 46 2667+ PTR? 204.84.96.198.in-addr.arpa. (44)
18:24:04.959478 eth0  In  IP 67.207.67.3.domain > comp3134-Winter2025.45074: Flags [.], ack 47, win 128, options [nop,nop,TS val 1749781806 ecr 4151017334], length 0
18:24:04.974685 eth0  In  IP 67.207.67.2.domain > comp3134-Winter2025.37761: 59798 NXDomain 0/1/1 (120)
18:24:04.974995 eth0  Out IP comp3134-Winter2025.37761 > 67.207.67.2.domain: 59798+ PTR? 204.84.96.198.in-addr.arpa. (44)
18:24:04.989751 eth0  In  IP 67.207.67.2.domain > comp3134-Winter2025.39526: 40349 NXDomain 0/1/1 (120)
18:24:04.989932 eth0  Out IP comp3134-Winter2025.39526 > 67.207.67.2.domain: 40349+ PTR? 204.84.96.198.in-addr.arpa. (44)
18:24:04.990031 eth0  In  IP 67.207.67.3.domain > comp3134-Winter2025.45074: Flags [P.], seq 1:112, ack 47, win 128, options [nop,nop,TS val 1749781837 ecr 4151017334], length 111 2667 NXDomain 0/1/0 (109)
18:24:04.990060 eth0  Out IP comp3134-Winter2025.45074 > 67.207.67.3.domain: Flags [.], ack 112, win 502, options [nop,nop,TS val 4151017366 ecr 1749781837], length 0
18:24:05.008046 eth0  In  IP 67.207.67.2.domain > comp3134-Winter2025.37761: 59798 NXDomain 0/1/0 (109)
18:24:05.008126 eth0  In  IP 67.207.67.2.domain > comp3134-Winter2025.39526: 40349 NXDomain 0/1/0 (109)
18:24:05.008490 lo    In  IP localhost.domain > localhost.50261: 55078 NXDomain 0/1/1 (120)
18:24:05.008787 lo    In  IP localhost.44352 > localhost.domain: 37190+ [1au] PTR? 208.21.203.159.in-addr.arpa. (56)
18:24:05.008986 eth0  Out IP comp3134-Winter2025.60244 > 67.207.67.2.domain: 41912+ [1au] PTR? 208.21.203.159.in-addr.arpa. (56)
18:24:05.010738 eth0  In  IP 67.207.67.2.domain > comp3134-Winter2025.60244: 41912 NXDomain 0/1/1 (123)
18:24:05.010872 eth0  Out IP comp3134-Winter2025.60244 > 67.207.67.2.domain: 41912+ PTR? 208.21.203.159.in-addr.arpa. (45)
18:24:05.012462 eth0  In  IP 67.207.67.2.domain > comp3134-Winter2025.60244: 41912 NXDomain 0/1/0 (112)
18:24:05.012796 lo    In  IP localhost.domain > localhost.44352: 37190*$ 2/0/1 PTR comp3134-Winter2025., PTR comp3134-Winter2025.local. (128)
18:24:05.013060 eth0  Out IP comp3134-Winter2025.ssh > 198.96.84.204.8841: Flags [P.], seq 480:716, ack 1, win 501, options [nop,nop,TS val 363012796 ecr 3355225294], length 236
18:24:05.013244 eth0  Out IP comp3134-Winter2025.ssh > 198.96.84.204.8841: Flags [P.], seq 716:752, ack 1, win 501, options [nop,nop,TS val 363012796 ecr 3355225294], length 36
18:24:05.013329 eth0  Out IP comp3134-Winter2025.ssh > 198.96.84.204.8841: Flags [P.], seq 752:964, ack 1, win 501, options [nop,nop,TS val 363012796 ecr 3355225294], length 212
18:24:05.013485 eth0  Out IP comp3134-Winter2025.ssh > 198.96.84.204.8841: Flags [P.], seq 964:1000, ack 1, win 501, options [nop,nop,TS val 363012796 ecr 3355225294], length 36
18:24:05.013527 eth0  Out IP comp3134-Winter2025.ssh > 198.96.84.204.8841: Flags [P.], seq 1000:1212, ack 1, win 501, options [nop,nop,TS val 363012796 ecr 3355225294], length 212
18:24:05.013645 eth0  Out IP comp3134-Winter2025.ssh > 198.96.84.204.8841: Flags [P.], seq 1212:1248, ack 1, win 501, options [nop,nop,TS val 363012797 ecr 3355225294], length 36
18:24:05.013775 eth0  Out IP comp3134-Winter2025.ssh > 198.96.84.204.8841: Flags [P.], seq 1248:1460, ack 1, win 501, options [nop,nop,TS val 363012797 ecr 3355225294], length 212
18:24:05.013818 eth0  Out IP comp3134-Winter2025.ssh > 198.96.84.204.8841: Flags [P.], seq 1460:1496, ack 1, win 501, options [nop,nop,TS val 363012797 ecr 3355225294], length 36
18:24:05.013892 eth0  Out IP comp3134-Winter2025.ssh > 198.96.84.204.8841: Flags [P.], seq 1496:1708, ack 1, win 501, options [nop,nop,TS val 363012797 ecr 3355225294], length 212
18:24:05.013937 eth0  Out IP comp3134-Winter2025.ssh > 198.96.84.204.8841: Flags [P.], seq 1708:1744, ack 1, win 501, options [nop,nop,TS val 363012797 ecr 3355225294], length 36
18:24:05.014010 eth0  Out IP comp3134-Winter2025.ssh > 198.96.84.204.8841: Flags [P.], seq 1744:1940, ack 1, win 501, options [nop,nop,TS val 363012797 ecr 3355225294], length 196
18:24:05.014056 eth0  Out IP comp3134-Winter2025.ssh > 198.96.84.204.8841: Flags [P.], seq 1940:1976, ack 1, win 501, options [nop,nop,TS val 363012797 ecr 3355225294], length 36
18:24:05.014541 lo    In  IP localhost.42910 > localhost.domain: 34061+ [1au] PTR? 239.165.248.89.in-addr.arpa. (56)
18:24:05.014663 eth0  Out IP comp3134-Winter2025.ssh > 218.92.0.165.43894: Flags [P.], seq 1204185251:1204185331, ack 848195736, win 503, options [nop,nop,TS val 1059177511 ecr 1560272112], length 80
18:24:05.014922 eth0  Out IP comp3134-Winter2025.49089 > 67.207.67.2.domain: 65392+ [1au] PTR? 239.165.248.89.in-addr.arpa. (56)
18:24:05.015035 eth0  Out IP comp3134-Winter2025.53218 > 67.207.67.2.domain: 19274+ [1au] PTR? 239.165.248.89.in-addr.arpa. (56)
18:24:05.015078 eth0  Out IP comp3134-Winter2025.45074 > 67.207.67.3.domain: Flags [P.], seq 47:94, ack 112, win 502, options [nop,nop,TS val 4151017391 ecr 1749781837], length 47 62906+ PTR? 239.165.248.89.in-addr.arpa. (45)
18:24:05.016204 eth0  In  IP 67.207.67.2.domain > comp3134-Winter2025.53218: 19274 1/0/1 PTR recyber.net. (81)
18:24:05.016314 eth0  In  IP 67.207.67.2.domain > comp3134-Winter2025.49089: 65392 1/0/1 PTR recyber.net. (81)
18:24:05.016395 lo    In  IP localhost.domain > localhost.42910: 34061 1/0/1 PTR recyber.net. (81)
18:24:05.058954 lo    In  IP localhost.40969 > localhost.domain: 50606+ [1au] PTR? 53.0.0.127.in-addr.arpa. (52)
18:24:05.059132 lo    In  IP localhost.domain > localhost.40969: 50606*$ 1/0/1 PTR localhost. (75)
18:24:05.059476 lo    In  IP localhost.47015 > localhost.domain: 18133+ [1au] PTR? 2.67.207.67.in-addr.arpa. (53)
18:24:05.059961 eth0  Out IP comp3134-Winter2025.59833 > 67.207.67.2.domain: 7595+ [1au] PTR? 2.67.207.67.in-addr.arpa. (53)
18:24:05.060066 eth0  Out IP comp3134-Winter2025.59655 > 67.207.67.2.domain: 19909+ [1au] PTR? 2.67.207.67.in-addr.arpa. (53)
18:24:05.060113 eth0  Out IP comp3134-Winter2025.45074 > 67.207.67.3.domain: Flags [P.], seq 94:138, ack 112, win 502, options [nop,nop,TS val 4151017436 ecr 1749781837], length 44 1388+ PTR? 2.67.207.67.in-addr.arpa. (42)
18:24:05.060345 eth0  In  IP 67.207.67.3.domain > comp3134-Winter2025.45074: Flags [.], ack 94, win 128, options [nop,nop,TS val 1749781907 ecr 4151017391], length 0
18:24:05.061096 eth0  In  IP 67.207.67.3.domain > comp3134-Winter2025.45074: Flags [.], ack 138, win 128, options [nop,nop,TS val 1749781908 ecr 4151017436], length 0
18:24:05.061273 eth0  In  IP 67.207.67.2.domain > comp3134-Winter2025.59833: 7595 NXDomain 0/1/1 (120)
18:24:05.061314 eth0  In  IP 67.207.67.2.domain > comp3134-Winter2025.59655: 19909 NXDomain 0/1/1 (120)
18:24:05.061501 eth0  Out IP comp3134-Winter2025.59833 > 67.207.67.2.domain: 7595+ PTR? 2.67.207.67.in-addr.arpa. (42)
18:24:05.061554 eth0  Out IP comp3134-Winter2025.59655 > 67.207.67.2.domain: 19909+ PTR? 2.67.207.67.in-addr.arpa. (42)
18:24:05.062677 eth0  Out IP comp3134-Winter2025.ssh > 198.96.84.204.8841: Flags [.], seq 1976:3214, ack 1, win 501, options [nop,nop,TS val 363012846 ecr 3355225294], length 1238
18:24:05.062718 eth0  In  IP 67.207.67.2.domain > comp3134-Winter2025.59833: 7595 NXDomain 0/1/0 (109)
18:24:05.062800 eth0  In  IP 67.207.67.2.domain > comp3134-Winter2025.59655: 19909 NXDomain 0/1/0 (109)
18:24:05.097483 eth0  In  IP 198.96.84.204.8841 > comp3134-Winter2025.ssh: Flags [.], ack 716, win 371, options [nop,nop,TS val 3355225514 ecr 363012796], length 0
18:24:05.097483 eth0  In  IP 198.96.84.204.8841 > comp3134-Winter2025.ssh: Flags [.], ack 752, win 371, options [nop,nop,TS val 3355225514 ecr 363012796], length 0
18:24:05.097557 eth0  Out IP comp3134-Winter2025.ssh > 198.96.84.204.8841: Flags [P.], seq 3214:3552, ack 1, win 501, options [nop,nop,TS val 363012880 ecr 3355225514], length 338
18:24:05.099956 eth0  In  IP 198.96.84.204.8841 > comp3134-Winter2025.ssh: Flags [.], ack 964, win 370, options [nop,nop,TS val 3355225514 ecr 363012796], length 0
18:24:05.106066 eth0  In  IP 198.96.84.204.8841 > comp3134-Winter2025.ssh: Flags [.], ack 964, win 370, options [nop,nop,TS val 3355225514 ecr 363012796], length 0
18:24:05.109178 eth0  In  IP 198.96.84.204.8841 > comp3134-Winter2025.ssh: Flags [.], ack 1000, win 370, options [nop,nop,TS val 3355225514 ecr 363012796], length 0
18:24:05.109179 eth0  In  IP 198.96.84.204.8841 > comp3134-Winter2025.ssh: Flags [.], ack 1212, win 369, options [nop,nop,TS val 3355225514 ecr 363012796], length 0
18:24:05.109179 eth0  In  IP 198.96.84.204.8841 > comp3134-Winter2025.ssh: Flags [.], ack 1248, win 369, options [nop,nop,TS val 3355225514 ecr 363012797], length 0
18:24:05.109179 eth0  In  IP 198.96.84.204.8841 > comp3134-Winter2025.ssh: Flags [.], ack 1460, win 368, options [nop,nop,TS val 3355225514 ecr 363012797], length 0
18:24:05.109179 eth0  In  IP 198.96.84.204.8841 > comp3134-Winter2025.ssh: Flags [.], ack 1496, win 368, options [nop,nop,TS val 3355225514 ecr 363012797], length 0
18:24:05.109179 eth0  In  IP 198.96.84.204.8841 > comp3134-Winter2025.ssh: Flags [.], ack 1708, win 367, options [nop,nop,TS val 3355225514 ecr 363012797], length 0
18:24:05.109179 eth0  In  IP 198.96.84.204.8841 > comp3134-Winter2025.ssh: Flags [.], ack 1744, win 367, options [nop,nop,TS val 3355225514 ecr 363012797], length 0
18:24:05.109179 eth0  In  IP 198.96.84.204.8841 > comp3134-Winter2025.ssh: Flags [.], ack 3214, win 356, options [nop,nop,TS val 3355225514 ecr 363012797], length 0
18:24:05.109322 eth0  In  IP 198.96.84.204.8841 > comp3134-Winter2025.ssh: Flags [.], ack 3552, win 354, options [nop,nop,TS val 3355225537 ecr 363012880], length 0
18:24:05.140765 eth0  In  IP 67.207.67.3.domain > comp3134-Winter2025.45074: Flags [P.], seq 112:184, ack 138, win 128, options [nop,nop,TS val 1749781988 ecr 4151017436], length 72 62906 1/0/0 PTR recyber.net. (70)
18:24:05.156785 eth0  In  IP 67.207.67.3.domain > comp3134-Winter2025.45074: Flags [P.], seq 184:295, ack 138, win 128, options [nop,nop,TS val 1749782004 ecr 4151017436], length 111 1388 NXDomain 0/1/0 (109)
18:24:05.156973 eth0  Out IP comp3134-Winter2025.45074 > 67.207.67.3.domain: Flags [.], ack 295, win 501, options [nop,nop,TS val 4151017533 ecr 1749781988], length 0
18:24:05.157251 lo    In  IP localhost.domain > localhost.47015: 18133 NXDomain 0/1/1 (120)
18:24:05.157472 eth0  Out IP comp3134-Winter2025.ssh > 198.96.84.204.8841: Flags [P.], seq 3552:3716, ack 1, win 501, options [nop,nop,TS val 363012940 ecr 3355225537], length 164
18:24:05.157591 eth0  Out IP comp3134-Winter2025.ssh > 198.96.84.204.8841: Flags [P.], seq 3716:3752, ack 1, win 501, options [nop,nop,TS val 363012940 ecr 3355225537], length 36
18:24:05.157667 eth0  Out IP comp3134-Winter2025.ssh > 198.96.84.204.8841: Flags [P.], seq 3752:3916, ack 1, win 501, options [nop,nop,TS val 363012941 ecr 3355225537], length 164
18:24:05.157699 eth0  Out IP comp3134-Winter2025.ssh > 198.96.84.204.8841: Flags [P.], seq 3916:3952, ack 1, win 501, options [nop,nop,TS val 363012941 ecr 3355225537], length 36
18:24:05.157830 lo    In  IP localhost.56959 > localhost.domain: 48262+ [1au] PTR? 3.67.207.67.in-addr.arpa. (53)
18:24:05.158209 eth0  Out IP comp3134-Winter2025.54834 > 67.207.67.2.domain: 23918+ [1au] PTR? 3.67.207.67.in-addr.arpa. (53)
18:24:05.158326 eth0  Out IP comp3134-Winter2025.40113 > 67.207.67.2.domain: 34982+ [1au] PTR? 3.67.207.67.in-addr.arpa. (53)
18:24:05.158359 eth0  Out IP comp3134-Winter2025.45074 > 67.207.67.3.domain: Flags [P.], seq 138:182, ack 295, win 501, options [nop,nop,TS val 4151017534 ecr 1749781988], length 44 32704+ PTR? 3.67.207.67.in-addr.arpa. (42)
18:24:05.159341 eth0  In  IP 67.207.67.3.domain > comp3134-Winter2025.45074: Flags [.], ack 182, win 128, options [nop,nop,TS val 1749782006 ecr 4151017534], length 0
18:24:05.165385 eth0  In  IP 198.96.84.204.8841 > comp3134-Winter2025.ssh: Flags [.], ack 3952, win 351, options [nop,nop,TS val 3355225601 ecr 363012940], length 0
18:24:05.176061 eth0  In  IP 67.207.67.3.domain > comp3134-Winter2025.45074: Flags [P.], seq 295:406, ack 182, win 128, options [nop,nop,TS val 1749782023 ecr 4151017534], length 111 32704 NXDomain 0/1/0 (109)
18:24:05.176062 eth0  In  IP 67.207.67.2.domain > comp3134-Winter2025.54834: 23918 NXDomain 0/1/1 (120)
18:24:05.176062 eth0  In  IP 67.207.67.2.domain > comp3134-Winter2025.40113: 34982 NXDomain 0/1/1 (120)
18:24:05.176339 eth0  Out IP comp3134-Winter2025.40113 > 67.207.67.2.domain: 34982+ PTR? 3.67.207.67.in-addr.arpa. (42)
18:24:05.176516 eth0  Out IP comp3134-Winter2025.54834 > 67.207.67.2.domain: 23918+ PTR? 3.67.207.67.in-addr.arpa. (42)
18:24:05.177638 eth0  In  IP 67.207.67.2.domain > comp3134-Winter2025.40113: 34982 NXDomain 0/1/0 (109)
18:24:05.177762 eth0  In  IP 67.207.67.2.domain > comp3134-Winter2025.54834: 23918 NXDomain 0/1/0 (109)
18:24:05.178088 lo    In  IP localhost.domain > localhost.56959: 48262 NXDomain 0/1/1 (120)
18:24:05.178791 eth0  Out IP comp3134-Winter2025.ssh > 198.96.84.204.8841: Flags [P.], seq 3952:6100, ack 1, win 501, options [nop,nop,TS val 363012962 ecr 3355225601], length 2148
18:24:05.178937 eth0  Out IP comp3134-Winter2025.ssh > 198.96.84.204.8841: Flags [P.], seq 6100:6292, ack 1, win 501, options [nop,nop,TS val 363012962 ecr 3355225601], length 192
18:24:05.178995 eth0  Out IP comp3134-Winter2025.ssh > 198.96.84.204.8841: Flags [P.], seq 6292:6456, ack 1, win 501, options [nop,nop,TS val 363012962 ecr 3355225601], length 164
18:24:05.179034 eth0  Out IP comp3134-Winter2025.ssh > 198.96.84.204.8841: Flags [P.], seq 6456:6492, ack 1, win 501, options [nop,nop,TS val 363012962 ecr 3355225601], length 36
18:24:05.179104 eth0  Out IP comp3134-Winter2025.ssh > 198.96.84.204.8841: Flags [P.], seq 6492:6632, ack 1, win 501, options [nop,nop,TS val 363012962 ecr 3355225601], length 140
18:24:05.179144 eth0  Out IP comp3134-Winter2025.ssh > 198.96.84.204.8841: Flags [P.], seq 6632:6668, ack 1, win 501, options [nop,nop,TS val 363012962 ecr 3355225601], length 36
18:24:05.179215 eth0  Out IP comp3134-Winter2025.ssh > 198.96.84.204.8841: Flags [P.], seq 6668:6824, ack 1, win 501, options [nop,nop,TS val 363012962 ecr 3355225601], length 156
18:24:05.179257 eth0  Out IP comp3134-Winter2025.ssh > 198.96.84.204.8841: Flags [P.], seq 6824:6860, ack 1, win 501, options [nop,nop,TS val 363012962 ecr 3355225601], length 36
18:24:05.179323 eth0  Out IP comp3134-Winter2025.ssh > 198.96.84.204.8841: Flags [P.], seq 6860:7000, ack 1, win 501, options [nop,nop,TS val 363012962 ecr 3355225601], length 140
18:24:05.179420 eth0  Out IP comp3134-Winter2025.ssh > 198.96.84.204.8841: Flags [P.], seq 7000:7216, ack 1, win 501, options [nop,nop,TS val 363012962 ecr 3355225601], length 216
18:24:05.179465 eth0  Out IP comp3134-Winter2025.ssh > 198.96.84.204.8841: Flags [P.], seq 7216:7252, ack 1, win 501, options [nop,nop,TS val 363012962 ecr 3355225601], length 36
18:24:05.179541 eth0  Out IP comp3134-Winter2025.ssh > 198.96.84.204.8841: Flags [P.], seq 7252:7464, ack 1, win 501, options [nop,nop,TS val 363012962 ecr 3355225601], length 212
18:24:05.179581 eth0  Out IP comp3134-Winter2025.ssh > 198.96.84.204.8841: Flags [P.], seq 7464:7500, ack 1, win 501, options [nop,nop,TS val 363012962 ecr 3355225601], length 36
18:24:05.179649 eth0  Out IP comp3134-Winter2025.ssh > 198.96.84.204.8841: Flags [P.], seq 7500:7712, ack 1, win 501, options [nop,nop,TS val 363012963 ecr 3355225601], length 212
18:24:05.179928 eth0  Out IP comp3134-Winter2025.ssh > 198.96.84.204.8841: Flags [P.], seq 7712:7748, ack 1, win 501, options [nop,nop,TS val 363012963 ecr 3355225601], length 36
18:24:05.180036 eth0  Out IP comp3134-Winter2025.ssh > 198.96.84.204.8841: Flags [P.], seq 7748:7960, ack 1, win 501, options [nop,nop,TS val 363012963 ecr 3355225601], length 212
18:24:05.180132 eth0  Out IP comp3134-Winter2025.ssh > 198.96.84.204.8841: Flags [P.], seq 7960:8208, ack 1, win 501, options [nop,nop,TS val 363012963 ecr 3355225601], length 248
18:24:05.180180 eth0  Out IP comp3134-Winter2025.ssh > 198.96.84.204.8841: Flags [P.], seq 8208:8244, ack 1, win 501, options [nop,nop,TS val 363012963 ecr 3355225601], length 36
18:24:05.180325 eth0  Out IP comp3134-Winter2025.ssh > 198.96.84.204.8841: Flags [P.], seq 8244:8464, ack 1, win 501, options [nop,nop,TS val 363012963 ecr 3355225601], length 220
18:24:05.180369 eth0  Out IP comp3134-Winter2025.ssh > 198.96.84.204.8841: Flags [P.], seq 8464:8500, ack 1, win 501, options [nop,nop,TS val 363012963 ecr 3355225601], length 36
18:24:05.180444 eth0  Out IP comp3134-Winter2025.ssh > 198.96.84.204.8841: Flags [P.], seq 8500:8712, ack 1, win 501, options [nop,nop,TS val 363012963 ecr 3355225601], length 212
18:24:05.181245 lo    In  IP localhost.52321 > localhost.domain: 8833+ [1au] PTR? 165.0.92.218.in-addr.arpa. (54)
18:24:05.181549 eth0  Out IP comp3134-Winter2025.53548 > 67.207.67.2.domain: 48252+ [1au] PTR? 165.0.92.218.in-addr.arpa. (54)
18:24:05.181648 eth0  Out IP comp3134-Winter2025.47307 > 67.207.67.2.domain: 8517+ [1au] PTR? 165.0.92.218.in-addr.arpa. (54)
18:24:05.181692 eth0  Out IP comp3134-Winter2025.45074 > 67.207.67.3.domain: Flags [P.], seq 182:227, ack 406, win 501, options [nop,nop,TS val 4151017558 ecr 1749782023], length 45 14738+ PTR? 165.0.92.218.in-addr.arpa. (43)
18:24:05.187650 eth0  In  IP 198.96.84.204.8841 > comp3134-Winter2025.ssh: Flags [.], ack 6860, win 329, options [nop,nop,TS val 3355225619 ecr 363012962], length 0
18:24:05.187650 eth0  In  IP 198.96.84.204.8841 > comp3134-Winter2025.ssh: Flags [.], ack 8712, win 315, options [nop,nop,TS val 3355225620 ecr 363012962], length 0
18:24:05.187999 eth0  Out IP comp3134-Winter2025.ssh > 198.96.84.204.8841: Flags [P.], seq 8712:10452, ack 1, win 501, options [nop,nop,TS val 363012971 ecr 3355225620], length 1740
18:24:05.191917 eth0  In  IP 198.96.84.204.8841 > comp3134-Winter2025.ssh: Flags [.], ack 10452, win 302, options [nop,nop,TS val 3355225628 ecr 363012971], length 0
18:24:05.228351 eth0  In  IP 67.207.67.3.domain > comp3134-Winter2025.45074: Flags [.], ack 227, win 128, options [nop,nop,TS val 1749782075 ecr 4151017558], length 0
18:24:05.387075 eth0  In  IP 67.207.67.2.domain > comp3134-Winter2025.47307: 8517 NXDomain 0/1/1 (103)
18:24:05.387275 eth0  Out IP comp3134-Winter2025.47307 > 67.207.67.2.domain: 8517+ PTR? 165.0.92.218.in-addr.arpa. (43)
18:24:05.387427 eth0  In  IP 67.207.67.3.domain > comp3134-Winter2025.45074: Flags [P.], seq 406:500, ack 227, win 128, options [nop,nop,TS val 1749782234 ecr 4151017558], length 94 14738 NXDomain 0/1/0 (92)
18:24:05.388494 eth0  In  IP 67.207.67.2.domain > comp3134-Winter2025.47307: 8517 NXDomain 0/1/0 (92)
18:24:05.406560 eth0  In  IP 67.207.67.2.domain > comp3134-Winter2025.53548: 48252 NXDomain 0/1/1 (103)
18:24:05.406905 eth0  Out IP comp3134-Winter2025.53548 > 67.207.67.2.domain: 48252+ PTR? 165.0.92.218.in-addr.arpa. (43)
18:24:05.408046 eth0  In  IP 67.207.67.2.domain > comp3134-Winter2025.53548: 48252 NXDomain 0/1/0 (92)
18:24:05.408368 lo    In  IP localhost.domain > localhost.52321: 8833 NXDomain 0/1/1 (103)
18:24:05.410099 eth0  Out IP comp3134-Winter2025.ssh > 198.96.84.204.8841: Flags [P.], seq 10452:12928, ack 1, win 501, options [nop,nop,TS val 363013193 ecr 3355225628], length 2476
18:24:05.410130 eth0  Out IP comp3134-Winter2025.ssh > 198.96.84.204.8841: Flags [P.], seq 12928:14584, ack 1, win 501, options [nop,nop,TS val 363013193 ecr 3355225628], length 1656
18:24:05.410196 eth0  Out IP comp3134-Winter2025.ssh > 198.96.84.204.8841: Flags [P.], seq 14584:17060, ack 1, win 501, options [nop,nop,TS val 363013193 ecr 3355225628], length 2476
18:24:05.410234 eth0  Out IP comp3134-Winter2025.ssh > 198.96.84.204.8841: Flags [P.], seq 17060:19536, ack 1, win 501, options [nop,nop,TS val 363013193 ecr 3355225628], length 2476
18:24:05.410247 eth0  Out IP comp3134-Winter2025.ssh > 198.96.84.204.8841: Flags [P.], seq 19536:22012, ack 1, win 501, options [nop,nop,TS val 363013193 ecr 3355225628], length 2476
18:24:05.410259 eth0  Out IP comp3134-Winter2025.ssh > 198.96.84.204.8841: Flags [P.], seq 22012:23028, ack 1, win 501, options [nop,nop,TS val 363013193 ecr 3355225628], length 1016
18:24:05.410287 eth0  Out IP comp3134-Winter2025.ssh > 198.96.84.204.8841: Flags [P.], seq 23028:23064, ack 1, win 501, options [nop,nop,TS val 363013193 ecr 3355225628], length 36
18:24:05.410374 eth0  Out IP comp3134-Winter2025.ssh > 198.96.84.204.8841: Flags [P.], seq 23064:23212, ack 1, win 501, options [nop,nop,TS val 363013193 ecr 3355225628], length 148
18:24:05.410458 eth0  Out IP comp3134-Winter2025.ssh > 198.96.84.204.8841: Flags [P.], seq 23212:23412, ack 1, win 501, options [nop,nop,TS val 363013193 ecr 3355225628], length 200
18:24:05.410496 eth0  Out IP comp3134-Winter2025.ssh > 198.96.84.204.8841: Flags [P.], seq 23412:23448, ack 1, win 501, options [nop,nop,TS val 363013193 ecr 3355225628], length 36
18:24:05.410566 eth0  Out IP comp3134-Winter2025.ssh > 198.96.84.204.8841: Flags [P.], seq 23448:23612, ack 1, win 501, options [nop,nop,TS val 363013193 ecr 3355225628], length 164
18:24:05.410691 eth0  Out IP comp3134-Winter2025.ssh > 198.96.84.204.8841: Flags [P.], seq 23612:23648, ack 1, win 501, options [nop,nop,TS val 363013194 ecr 3355225628], length 36
18:24:05.410752 eth0  Out IP comp3134-Winter2025.ssh > 198.96.84.204.8841: Flags [P.], seq 23648:23908, ack 1, win 501, options [nop,nop,TS val 363013194 ecr 3355225628], length 260
18:24:05.410795 eth0  Out IP comp3134-Winter2025.ssh > 198.96.84.204.8841: Flags [P.], seq 23908:23944, ack 1, win 501, options [nop,nop,TS val 363013194 ecr 3355225628], length 36
18:24:05.410873 eth0  Out IP comp3134-Winter2025.ssh > 198.96.84.204.8841: Flags [P.], seq 23944:24148, ack 1, win 501, options [nop,nop,TS val 363013194 ecr 3355225628], length 204
18:24:05.410908 eth0  Out IP comp3134-Winter2025.ssh > 198.96.84.204.8841: Flags [P.], seq 24148:24184, ack 1, win 501, options [nop,nop,TS val 363013194 ecr 3355225628], length 36
18:24:05.410980 eth0  Out IP comp3134-Winter2025.ssh > 198.96.84.204.8841: Flags [P.], seq 24184:24388, ack 1, win 501, options [nop,nop,TS val 363013194 ecr 3355225628], length 204
18:24:05.411068 eth0  Out IP comp3134-Winter2025.ssh > 198.96.84.204.8841: Flags [P.], seq 24388:24644, ack 1, win 501, options [nop,nop,TS val 363013194 ecr 3355225628], length 256
18:24:05.411098 eth0  Out IP comp3134-Winter2025.ssh > 198.96.84.204.8841: Flags [P.], seq 24644:24680, ack 1, win 501, options [nop,nop,TS val 363013194 ecr 3355225628], length 36
18:24:05.411148 eth0  Out IP comp3134-Winter2025.ssh > 198.96.84.204.8841: Flags [P.], seq 24680:24884, ack 1, win 501, options [nop,nop,TS val 363013194 ecr 3355225628], length 204
18:24:05.411176 eth0  Out IP comp3134-Winter2025.ssh > 198.96.84.204.8841: Flags [P.], seq 24884:24920, ack 1, win 501, options [nop,nop,TS val 363013194 ecr 3355225628], length 36
18:24:05.411226 eth0  Out IP comp3134-Winter2025.ssh > 198.96.84.204.8841: Flags [P.], seq 24920:25124, ack 1, win 501, options [nop,nop,TS val 363013194 ecr 3355225628], length 204
18:24:05.411256 eth0  Out IP comp3134-Winter2025.ssh > 198.96.84.204.8841: Flags [P.], seq 25124:25160, ack 1, win 501, options [nop,nop,TS val 363013194 ecr 3355225628], length 36
18:24:05.430729 eth0  Out IP comp3134-Winter2025.45074 > 67.207.67.3.domain: Flags [.], ack 500, win 501, options [nop,nop,TS val 4151017807 ecr 1749782234], length 0
18:24:05.474914 eth0  Out IP comp3134-Winter2025.ssh > 198.96.84.204.8841: Flags [P.], seq 25160:25300, ack 1, win 501, options [nop,nop,TS val 363013258 ecr 3355225628], length 140
18:24:05.474976 eth0  Out IP comp3134-Winter2025.ssh > 198.96.84.204.8841: Flags [P.], seq 25300:25336, ack 1, win 501, options [nop,nop,TS val 363013258 ecr 3355225628], length 36
18:24:05.475038 eth0  Out IP comp3134-Winter2025.ssh > 198.96.84.204.8841: Flags [P.], seq 25336:25492, ack 1, win 501, options [nop,nop,TS val 363013258 ecr 3355225628], length 156
18:24:05.475066 eth0  Out IP comp3134-Winter2025.ssh > 198.96.84.204.8841: Flags [P.], seq 25492:25528, ack 1, win 501, options [nop,nop,TS val 363013258 ecr 3355225628], length 36
18:24:05.475124 eth0  Out IP comp3134-Winter2025.ssh > 198.96.84.204.8841: Flags [P.], seq 25528:25772, ack 1, win 501, options [nop,nop,TS val 363013258 ecr 3355225628], length 244
18:24:05.475161 eth0  Out IP comp3134-Winter2025.ssh > 198.96.84.204.8841: Flags [P.], seq 25772:25808, ack 1, win 501, options [nop,nop,TS val 363013258 ecr 3355225628], length 36
18:24:05.475237 eth0  Out IP comp3134-Winter2025.ssh > 198.96.84.204.8841: Flags [P.], seq 25808:25948, ack 1, win 501, options [nop,nop,TS val 363013258 ecr 3355225628], length 140
18:24:05.475266 eth0  Out IP comp3134-Winter2025.ssh > 198.96.84.204.8841: Flags [P.], seq 25948:25984, ack 1, win 501, options [nop,nop,TS val 363013258 ecr 3355225628], length 36
18:24:05.475313 eth0  Out IP comp3134-Winter2025.ssh > 198.96.84.204.8841: Flags [P.], seq 25984:26124, ack 1, win 501, options [nop,nop,TS val 363013258 ecr 3355225628], length 140
18:24:05.475342 eth0  Out IP comp3134-Winter2025.ssh > 198.96.84.204.8841: Flags [P.], seq 26124:26160, ack 1, win 501, options [nop,nop,TS val 363013258 ecr 3355225628], length 36
18:24:05.475390 eth0  Out IP comp3134-Winter2025.ssh > 198.96.84.204.8841: Flags [P.], seq 26160:26316, ack 1, win 501, options [nop,nop,TS val 363013258 ecr 3355225628], length 156
18:24:05.475437 eth0  Out IP comp3134-Winter2025.ssh > 198.96.84.204.8841: Flags [P.], seq 26316:26352, ack 1, win 501, options [nop,nop,TS val 363013258 ecr 3355225628], length 36
18:24:05.475473 eth0  Out IP comp3134-Winter2025.ssh > 198.96.84.204.8841: Flags [P.], seq 26352:26492, ack 1, win 501, options [nop,nop,TS val 363013258 ecr 3355225628], length 140
18:24:05.475500 eth0  Out IP comp3134-Winter2025.ssh > 198.96.84.204.8841: Flags [P.], seq 26492:26528, ack 1, win 501, options [nop,nop,TS val 363013258 ecr 3355225628], length 36
18:24:05.475569 eth0  Out IP comp3134-Winter2025.ssh > 198.96.84.204.8841: Flags [P.], seq 26528:26652, ack 1, win 501, options [nop,nop,TS val 363013258 ecr 3355225628], length 124
18:24:05.475827 eth0  Out IP comp3134-Winter2025.ssh > 198.96.84.204.8841: Flags [P.], seq 26652:26688, ack 1, win 501, options [nop,nop,TS val 363013259 ecr 3355225628], length 36
18:24:05.475965 eth0  Out IP comp3134-Winter2025.ssh > 198.96.84.204.8841: Flags [P.], seq 26688:26908, ack 1, win 501, options [nop,nop,TS val 363013259 ecr 3355225628], length 220
18:24:05.476006 eth0  Out IP comp3134-Winter2025.ssh > 198.96.84.204.8841: Flags [P.], seq 26908:26944, ack 1, win 501, options [nop,nop,TS val 363013259 ecr 3355225628], length 36
18:24:05.476056 eth0  Out IP comp3134-Winter2025.ssh > 198.96.84.204.8841: Flags [P.], seq 26944:27164, ack 1, win 501, options [nop,nop,TS val 363013259 ecr 3355225628], length 220
18:24:05.476126 eth0  Out IP comp3134-Winter2025.ssh > 198.96.84.204.8841: Flags [P.], seq 27164:27420, ack 1, win 501, options [nop,nop,TS val 363013259 ecr 3355225628], length 256
18:24:05.503048 eth0  In  IP 198.96.84.204.8841 > comp3134-Winter2025.ssh: Flags [.], ack 12928, win 283, options [nop,nop,TS val 3355225938 ecr 363013193], length 0
18:24:05.503141 eth0  Out IP comp3134-Winter2025.ssh > 198.96.84.204.8841: Flags [P.], seq 27420:29896, ack 1, win 501, options [nop,nop,TS val 363013286 ecr 3355225938], length 2476
18:24:05.503171 eth0  Out IP comp3134-Winter2025.ssh > 198.96.84.204.8841: Flags [P.], seq 29896:32372, ack 1, win 501, options [nop,nop,TS val 363013286 ecr 3355225938], length 2476
18:24:05.603170 eth0  In  IP 198.96.84.204.8841 > comp3134-Winter2025.ssh: Flags [.], ack 23028, win 207, options [nop,nop,TS val 3355225938 ecr 363013193], length 0
18:24:05.603171 eth0  In  IP 198.96.84.204.8841 > comp3134-Winter2025.ssh: Flags [.], ack 23064, win 207, options [nop,nop,TS val 3355225938 ecr 363013193], length 0
18:24:05.603171 eth0  In  IP 198.96.84.204.8841 > comp3134-Winter2025.ssh: Flags [.], ack 23212, win 206, options [nop,nop,TS val 3355225938 ecr 363013193], length 0
18:24:05.603171 eth0  In  IP 198.96.84.204.8841 > comp3134-Winter2025.ssh: Flags [.], ack 23412, win 205, options [nop,nop,TS val 3355225938 ecr 363013193], length 0
18:24:05.603171 eth0  In  IP 198.96.84.204.8841 > comp3134-Winter2025.ssh: Flags [.], ack 23448, win 205, options [nop,nop,TS val 3355225938 ecr 363013193], length 0
18:24:05.603171 eth0  In  IP 198.96.84.204.8841 > comp3134-Winter2025.ssh: Flags [.], ack 23612, win 204, options [nop,nop,TS val 3355225938 ecr 363013193], length 0
18:24:05.603171 eth0  In  IP 198.96.84.204.8841 > comp3134-Winter2025.ssh: Flags [.], ack 23648, win 204, options [nop,nop,TS val 3355225938 ecr 363013194], length 0
18:24:05.603171 eth0  In  IP 198.96.84.204.8841 > comp3134-Winter2025.ssh: Flags [.], ack 23908, win 202, options [nop,nop,TS val 3355225938 ecr 363013194], length 0
18:24:05.603255 eth0  Out IP comp3134-Winter2025.ssh > 198.96.84.204.8841: Flags [P.], seq 32372:34848, ack 1, win 501, options [nop,nop,TS val 363013386 ecr 3355225938], length 2476
18:24:05.603273 eth0  Out IP comp3134-Winter2025.ssh > 198.96.84.204.8841: Flags [P.], seq 34848:37324, ack 1, win 501, options [nop,nop,TS val 363013386 ecr 3355225938], length 2476
18:24:05.603310 eth0  In  IP 198.96.84.204.8841 > comp3134-Winter2025.ssh: Flags [.], ack 23944, win 202, options [nop,nop,TS val 3355225938 ecr 363013194], length 0
18:24:05.603310 eth0  In  IP 198.96.84.204.8841 > comp3134-Winter2025.ssh: Flags [.], ack 24148, win 201, options [nop,nop,TS val 3355225938 ecr 363013194], length 0
18:24:05.603310 eth0  In  IP 198.96.84.204.8841 > comp3134-Winter2025.ssh: Flags [.], ack 25160, win 194, options [nop,nop,TS val 3355225939 ecr 363013194], length 0
18:24:05.603310 eth0  In  IP 198.96.84.204.8841 > comp3134-Winter2025.ssh: Flags [.], ack 27420, win 177, options [nop,nop,TS val 3355225939 ecr 363013258], length 0
18:24:05.603310 eth0  In  IP 198.96.84.204.8841 > comp3134-Winter2025.ssh: Flags [.], ack 32372, win 176, options [nop,nop,TS val 3355225948 ecr 363013286], length 0
18:24:05.603360 eth0  Out IP comp3134-Winter2025.ssh > 198.96.84.204.8841: Flags [P.], seq 37324:38688, ack 1, win 501, options [nop,nop,TS val 363013386 ecr 3355225948], length 1364
18:24:05.616915 eth0  In  IP 198.96.84.204.8841 > comp3134-Winter2025.ssh: Flags [.], ack 38688, win 501, options [nop,nop,TS val 3355226044 ecr 363013386], length 0
18:24:05.682903 eth0  Out IP comp3134-Winter2025.ssh > 198.96.84.204.8841: Flags [P.], seq 38688:38892, ack 1, win 501, options [nop,nop,TS val 363013466 ecr 3355226044], length 204
18:24:05.683016 eth0  Out IP comp3134-Winter2025.ssh > 198.96.84.204.8841: Flags [P.], seq 38892:38928, ack 1, win 501, options [nop,nop,TS val 363013466 ecr 3355226044], length 36
18:24:05.683032 eth0  Out IP comp3134-Winter2025.ssh > 198.96.84.204.8841: Flags [P.], seq 38928:39132, ack 1, win 501, options [nop,nop,TS val 363013466 ecr 3355226044], length 204
18:24:05.683059 eth0  Out IP comp3134-Winter2025.ssh > 198.96.84.204.8841: Flags [P.], seq 39132:39168, ack 1, win 501, options [nop,nop,TS val 363013466 ecr 3355226044], length 36
18:24:05.683107 eth0  Out IP comp3134-Winter2025.ssh > 198.96.84.204.8841: Flags [P.], seq 39168:39372, ack 1, win 501, options [nop,nop,TS val 363013466 ecr 3355226044], length 204
18:24:05.683134 eth0  Out IP comp3134-Winter2025.ssh > 198.96.84.204.8841: Flags [P.], seq 39372:39408, ack 1, win 501, options [nop,nop,TS val 363013466 ecr 3355226044], length 36
18:24:05.683179 eth0  Out IP comp3134-Winter2025.ssh > 198.96.84.204.8841: Flags [P.], seq 39408:39612, ack 1, win 501, options [nop,nop,TS val 363013466 ecr 3355226044], length 204
18:24:05.683207 eth0  Out IP comp3134-Winter2025.ssh > 198.96.84.204.8841: Flags [P.], seq 39612:39648, ack 1, win 501, options [nop,nop,TS val 363013466 ecr 3355226044], length 36
18:24:05.683251 eth0  Out IP comp3134-Winter2025.ssh > 198.96.84.204.8841: Flags [P.], seq 39648:39852, ack 1, win 501, options [nop,nop,TS val 363013466 ecr 3355226044], length 204
18:24:05.683278 eth0  Out IP comp3134-Winter2025.ssh > 198.96.84.204.8841: Flags [P.], seq 39852:39888, ack 1, win 501, options [nop,nop,TS val 363013466 ecr 3355226044], length 36
18:24:05.683323 eth0  Out IP comp3134-Winter2025.ssh > 198.96.84.204.8841: Flags [P.], seq 39888:40092, ack 1, win 501, options [nop,nop,TS val 363013466 ecr 3355226044], length 204
18:24:05.683360 eth0  Out IP comp3134-Winter2025.ssh > 198.96.84.204.8841: Flags [P.], seq 40092:40128, ack 1, win 501, options [nop,nop,TS val 363013466 ecr 3355226044], length 36
18:24:05.683408 eth0  Out IP comp3134-Winter2025.ssh > 198.96.84.204.8841: Flags [P.], seq 40128:40332, ack 1, win 501, options [nop,nop,TS val 363013466 ecr 3355226044], length 204
18:24:05.683435 eth0  Out IP comp3134-Winter2025.ssh > 198.96.84.204.8841: Flags [P.], seq 40332:40368, ack 1, win 501, options [nop,nop,TS val 363013466 ecr 3355226044], length 36
18:24:05.683478 eth0  Out IP comp3134-Winter2025.ssh > 198.96.84.204.8841: Flags [P.], seq 40368:40572, ack 1, win 501, options [nop,nop,TS val 363013466 ecr 3355226044], length 204
18:24:05.683526 eth0  Out IP comp3134-Winter2025.ssh > 198.96.84.204.8841: Flags [P.], seq 40572:40608, ack 1, win 501, options [nop,nop,TS val 363013466 ecr 3355226044], length 36
18:24:05.683601 eth0  Out IP comp3134-Winter2025.ssh > 198.96.84.204.8841: Flags [P.], seq 40608:40828, ack 1, win 501, options [nop,nop,TS val 363013466 ecr 3355226044], length 220
18:24:05.683634 eth0  Out IP comp3134-Winter2025.ssh > 198.96.84.204.8841: Flags [P.], seq 40828:40864, ack 1, win 501, options [nop,nop,TS val 363013467 ecr 3355226044], length 36
18:24:05.683854 eth0  Out IP comp3134-Winter2025.ssh > 198.96.84.204.8841: Flags [P.], seq 40864:41084, ack 1, win 501, options [nop,nop,TS val 363013467 ecr 3355226044], length 220
18:24:05.683890 eth0  Out IP comp3134-Winter2025.ssh > 198.96.84.204.8841: Flags [P.], seq 41084:41120, ack 1, win 501, options [nop,nop,TS val 363013467 ecr 3355226044], length 36
18:24:05.683951 eth0  Out IP comp3134-Winter2025.ssh > 198.96.84.204.8841: Flags [P.], seq 41120:41324, ack 1, win 501, options [nop,nop,TS val 363013467 ecr 3355226044], length 204
18:24:05.683984 eth0  Out IP comp3134-Winter2025.ssh > 198.96.84.204.8841: Flags [P.], seq 41324:41360, ack 1, win 501, options [nop,nop,TS val 363013467 ecr 3355226044], length 36
18:24:05.684043 eth0  Out IP comp3134-Winter2025.ssh > 198.96.84.204.8841: Flags [P.], seq 41360:41564, ack 1, win 501, options [nop,nop,TS val 363013467 ecr 3355226044], length 204
18:24:05.684071 eth0  Out IP comp3134-Winter2025.ssh > 198.96.84.204.8841: Flags [P.], seq 41564:41600, ack 1, win 501, options [nop,nop,TS val 363013467 ecr 3355226044], length 36
18:24:05.684118 eth0  Out IP comp3134-Winter2025.ssh > 198.96.84.204.8841: Flags [P.], seq 41600:41804, ack 1, win 501, options [nop,nop,TS val 363013467 ecr 3355226044], length 204
18:24:05.684159 eth0  Out IP comp3134-Winter2025.ssh > 198.96.84.204.8841: Flags [P.], seq 41804:41840, ack 1, win 501, options [nop,nop,TS val 363013467 ecr 3355226044], length 36
18:24:05.684217 eth0  Out IP comp3134-Winter2025.ssh > 198.96.84.204.8841: Flags [P.], seq 41840:42044, ack 1, win 501, options [nop,nop,TS val 363013467 ecr 3355226044], length 204
18:24:05.684245 eth0  Out IP comp3134-Winter2025.ssh > 198.96.84.204.8841: Flags [P.], seq 42044:42080, ack 1, win 501, options [nop,nop,TS val 363013467 ecr 3355226044], length 36
18:24:05.684290 eth0  Out IP comp3134-Winter2025.ssh > 198.96.84.204.8841: Flags [P.], seq 42080:42284, ack 1, win 501, options [nop,nop,TS val 363013467 ecr 3355226044], length 204
18:24:05.684355 eth0  Out IP comp3134-Winter2025.ssh > 198.96.84.204.8841: Flags [P.], seq 42284:42540, ack 1, win 501, options [nop,nop,TS val 363013467 ecr 3355226044], length 256
18:24:05.684609 eth0  Out IP comp3134-Winter2025.ssh > 198.96.84.204.8841: Flags [P.], seq 42540:42816, ack 1, win 501, options [nop,nop,TS val 363013467 ecr 3355226044], length 276
18:24:05.687222 eth0  In  IP 198.96.84.204.8841 > comp3134-Winter2025.ssh: Flags [.], ack 38892, win 524, options [nop,nop,TS val 3355226123 ecr 363013466], length 0
18:24:05.687222 eth0  In  IP 198.96.84.204.8841 > comp3134-Winter2025.ssh: Flags [.], ack 39132, win 546, options [nop,nop,TS val 3355226123 ecr 363013466], length 0
18:24:05.687223 eth0  In  IP 198.96.84.204.8841 > comp3134-Winter2025.ssh: Flags [.], ack 39372, win 569, options [nop,nop,TS val 3355226123 ecr 363013466], length 0
