root@comp3134-Winter2025:~# tcpdump -i any 'tcp[13] & 16 != 0'
tcpdump: data link type LINUX_SLL2
tcpdump: verbose output suppressed, use -v[v]... for full protocol decode
listening on any, link-type LINUX_SLL2 (Linux cooked v2), snapshot length 262144 bytes
18:40:59.002804 eth0  Out IP comp3134-Winter2025.ssh > 198.96.84.204.8841: Flags [P.], seq 3701946555:3701946767, ack 3362594192, win 501, options [nop,nop,TS val 364026786 ecr 3356239427], length 212
18:40:59.004859 eth0  Out IP comp3134-Winter2025.ssh > 198.96.84.204.8841: Flags [P.], seq 212:320, ack 1, win 501, options [nop,nop,TS val 364026788 ecr 3356239427], length 108
18:40:59.004988 eth0  Out IP comp3134-Winter2025.ssh > 198.96.84.204.8841: Flags [P.], seq 320:484, ack 1, win 501, options [nop,nop,TS val 364026788 ecr 3356239427], length 164
18:40:59.005040 eth0  Out IP comp3134-Winter2025.ssh > 198.96.84.204.8841: Flags [P.], seq 484:552, ack 1, win 501, options [nop,nop,TS val 364026788 ecr 3356239427], length 68
18:40:59.005209 eth0  Out IP comp3134-Winter2025.ssh > 198.96.84.204.8841: Flags [P.], seq 552:588, ack 1, win 501, options [nop,nop,TS val 364026788 ecr 3356239427], length 36
18:40:59.010647 eth0  In  IP 198.96.84.204.8841 > comp3134-Winter2025.ssh: Flags [.], ack 212, win 1309, options [nop,nop,TS val 3356239445 ecr 364026786], length 0
18:40:59.010648 eth0  In  IP 198.96.84.204.8841 > comp3134-Winter2025.ssh: Flags [.], ack 320, win 1309, options [nop,nop,TS val 3356239445 ecr 364026788], length 0
18:40:59.010648 eth0  In  IP 198.96.84.204.8841 > comp3134-Winter2025.ssh: Flags [.], ack 484, win 1308, options [nop,nop,TS val 3356239445 ecr 364026788], length 0
18:40:59.010648 eth0  In  IP 198.96.84.204.8841 > comp3134-Winter2025.ssh: Flags [.], ack 552, win 1308, options [nop,nop,TS val 3356239445 ecr 364026788], length 0
18:40:59.010648 eth0  In  IP 198.96.84.204.8841 > comp3134-Winter2025.ssh: Flags [.], ack 588, win 1308, options [nop,nop,TS val 3356239445 ecr 364026788], length 0
18:40:59.106670 eth0  In  IP 67.207.67.3.domain > comp3134-Winter2025.42330: Flags [S.], seq 110967592, ack 3298429846, win 65160, options [mss 1460,sackOK,TS val 1750795953 ecr 4152031480,nop,wscale 9], length 0
18:40:59.106742 eth0  Out IP comp3134-Winter2025.42330 > 67.207.67.3.domain: Flags [.], ack 1, win 502, options [nop,nop,TS val 4152031483 ecr 1750795953], length 0
18:40:59.106800 eth0  Out IP comp3134-Winter2025.42330 > 67.207.67.3.domain: Flags [P.], seq 1:47, ack 1, win 502, options [nop,nop,TS val 4152031483 ecr 1750795953], length 46 54948+ PTR? 204.84.96.198.in-addr.arpa. (44)
18:40:59.107914 eth0  In  IP 67.207.67.3.domain > comp3134-Winter2025.42330: Flags [.], ack 47, win 128, options [nop,nop,TS val 1750795955 ecr 4152031483], length 0
18:40:59.108089 eth0  In  IP 67.207.67.3.domain > comp3134-Winter2025.42330: Flags [P.], seq 1:112, ack 47, win 128, options [nop,nop,TS val 1750795956 ecr 4152031483], length 111 54948 NXDomain 0/1/0 (109)
18:40:59.108124 eth0  Out IP comp3134-Winter2025.42330 > 67.207.67.3.domain: Flags [.], ack 112, win 502, options [nop,nop,TS val 4152031484 ecr 1750795956], length 0
18:40:59.112100 eth0  Out IP comp3134-Winter2025.ssh > 198.96.84.204.8841: Flags [P.], seq 588:824, ack 1, win 501, options [nop,nop,TS val 364026895 ecr 3356239445], length 236
18:40:59.112241 eth0  Out IP comp3134-Winter2025.ssh > 198.96.84.204.8841: Flags [P.], seq 824:860, ack 1, win 501, options [nop,nop,TS val 364026895 ecr 3356239445], length 36
18:40:59.112278 eth0  Out IP comp3134-Winter2025.ssh > 198.96.84.204.8841: Flags [P.], seq 860:1072, ack 1, win 501, options [nop,nop,TS val 364026895 ecr 3356239445], length 212
18:40:59.112306 eth0  Out IP comp3134-Winter2025.ssh > 198.96.84.204.8841: Flags [P.], seq 1072:1108, ack 1, win 501, options [nop,nop,TS val 364026895 ecr 3356239445], length 36
18:40:59.112359 eth0  Out IP comp3134-Winter2025.ssh > 198.96.84.204.8841: Flags [P.], seq 1108:1320, ack 1, win 501, options [nop,nop,TS val 364026895 ecr 3356239445], length 212
18:40:59.112388 eth0  Out IP comp3134-Winter2025.ssh > 198.96.84.204.8841: Flags [P.], seq 1320:1356, ack 1, win 501, options [nop,nop,TS val 364026895 ecr 3356239445], length 36
18:40:59.112435 eth0  Out IP comp3134-Winter2025.ssh > 198.96.84.204.8841: Flags [P.], seq 1356:1568, ack 1, win 501, options [nop,nop,TS val 364026895 ecr 3356239445], length 212
18:40:59.112463 eth0  Out IP comp3134-Winter2025.ssh > 198.96.84.204.8841: Flags [P.], seq 1568:1604, ack 1, win 501, options [nop,nop,TS val 364026895 ecr 3356239445], length 36
18:40:59.112510 eth0  Out IP comp3134-Winter2025.ssh > 198.96.84.204.8841: Flags [P.], seq 1604:1816, ack 1, win 501, options [nop,nop,TS val 364026895 ecr 3356239445], length 212
18:40:59.112539 eth0  Out IP comp3134-Winter2025.ssh > 198.96.84.204.8841: Flags [P.], seq 1816:1852, ack 1, win 501, options [nop,nop,TS val 364026895 ecr 3356239445], length 36
18:40:59.142762 eth0  Out IP comp3134-Winter2025.ssh > 198.96.84.204.8841: Flags [P.], seq 1852:3052, ack 1, win 501, options [nop,nop,TS val 364026926 ecr 3356239445], length 1200
18:40:59.203620 eth0  In  IP 198.96.84.204.8841 > comp3134-Winter2025.ssh: Flags [.], ack 824, win 1307, options [nop,nop,TS val 3356239554 ecr 364026895], length 0
18:40:59.203620 eth0  In  IP 198.96.84.204.8841 > comp3134-Winter2025.ssh: Flags [.], ack 860, win 1307, options [nop,nop,TS val 3356239554 ecr 364026895], length 0
18:40:59.203620 eth0  In  IP 198.96.84.204.8841 > comp3134-Winter2025.ssh: Flags [.], ack 1072, win 1306, options [nop,nop,TS val 3356239554 ecr 364026895], length 0
18:40:59.203621 eth0  In  IP 198.96.84.204.8841 > comp3134-Winter2025.ssh: Flags [.], ack 1108, win 1306, options [nop,nop,TS val 3356239554 ecr 364026895], length 0
18:40:59.203621 eth0  In  IP 198.96.84.204.8841 > comp3134-Winter2025.ssh: Flags [.], ack 1320, win 1305, options [nop,nop,TS val 3356239554 ecr 364026895], length 0
18:40:59.203621 eth0  In  IP 198.96.84.204.8841 > comp3134-Winter2025.ssh: Flags [.], ack 1356, win 1305, options [nop,nop,TS val 3356239554 ecr 364026895], length 0
18:40:59.203621 eth0  In  IP 198.96.84.204.8841 > comp3134-Winter2025.ssh: Flags [.], ack 1568, win 1304, options [nop,nop,TS val 3356239554 ecr 364026895], length 0
18:40:59.203621 eth0  In  IP 198.96.84.204.8841 > comp3134-Winter2025.ssh: Flags [.], ack 1604, win 1304, options [nop,nop,TS val 3356239554 ecr 364026895], length 0
18:40:59.203720 eth0  In  IP 198.96.84.204.8841 > comp3134-Winter2025.ssh: Flags [.], ack 1816, win 1303, options [nop,nop,TS val 3356239554 ecr 364026895], length 0
18:40:59.203720 eth0  In  IP 198.96.84.204.8841 > comp3134-Winter2025.ssh: Flags [.], ack 1852, win 1303, options [nop,nop,TS val 3356239554 ecr 364026895], length 0
18:40:59.206023 eth0  In  IP 198.96.84.204.8841 > comp3134-Winter2025.ssh: Flags [.], ack 3052, win 1303, options [nop,nop,TS val 3356239641 ecr 364026926], length 0
18:40:59.207761 eth0  Out IP comp3134-Winter2025.42330 > 67.207.67.3.domain: Flags [P.], seq 47:91, ack 112, win 502, options [nop,nop,TS val 4152031584 ecr 1750795956], length 44 48048+ PTR? 3.67.207.67.in-addr.arpa. (42)
18:40:59.208971 eth0  In  IP 67.207.67.3.domain > comp3134-Winter2025.42330: Flags [P.], seq 112:223, ack 91, win 128, options [nop,nop,TS val 1750796056 ecr 4152031584], length 111 48048 NXDomain 0/1/0 (109)
18:40:59.209037 eth0  Out IP comp3134-Winter2025.42330 > 67.207.67.3.domain: Flags [.], ack 223, win 502, options [nop,nop,TS val 4152031585 ecr 1750796056], length 0
18:40:59.211193 eth0  Out IP comp3134-Winter2025.ssh > 198.96.84.204.8841: Flags [P.], seq 3052:3304, ack 1, win 501, options [nop,nop,TS val 364026994 ecr 3356239641], length 252
18:40:59.211527 eth0  Out IP comp3134-Winter2025.ssh > 198.96.84.204.8841: Flags [P.], seq 3304:3340, ack 1, win 501, options [nop,nop,TS val 364026994 ecr 3356239641], length 36
18:40:59.211737 eth0  Out IP comp3134-Winter2025.ssh > 198.96.84.204.8841: Flags [P.], seq 3340:3544, ack 1, win 501, options [nop,nop,TS val 364026995 ecr 3356239641], length 204
18:40:59.211858 eth0  Out IP comp3134-Winter2025.ssh > 198.96.84.204.8841: Flags [P.], seq 3544:3580, ack 1, win 501, options [nop,nop,TS val 364026995 ecr 3356239641], length 36
18:40:59.212056 eth0  Out IP comp3134-Winter2025.ssh > 198.96.84.204.8841: Flags [P.], seq 3580:3840, ack 1, win 501, options [nop,nop,TS val 364026995 ecr 3356239641], length 260
18:40:59.212168 eth0  Out IP comp3134-Winter2025.ssh > 198.96.84.204.8841: Flags [P.], seq 3840:3876, ack 1, win 501, options [nop,nop,TS val 364026995 ecr 3356239641], length 36
18:40:59.212212 eth0  Out IP comp3134-Winter2025.ssh > 198.96.84.204.8841: Flags [P.], seq 3876:4080, ack 1, win 501, options [nop,nop,TS val 364026995 ecr 3356239641], length 204
18:40:59.212249 eth0  Out IP comp3134-Winter2025.ssh > 198.96.84.204.8841: Flags [P.], seq 4080:4116, ack 1, win 501, options [nop,nop,TS val 364026995 ecr 3356239641], length 36
18:40:59.212330 eth0  Out IP comp3134-Winter2025.ssh > 198.96.84.204.8841: Flags [P.], seq 4116:4360, ack 1, win 501, options [nop,nop,TS val 364026995 ecr 3356239641], length 244
18:40:59.212439 eth0  Out IP comp3134-Winter2025.ssh > 198.96.84.204.8841: Flags [P.], seq 4360:4600, ack 1, win 501, options [nop,nop,TS val 364026995 ecr 3356239641], length 240
18:40:59.212467 eth0  Out IP comp3134-Winter2025.ssh > 198.96.84.204.8841: Flags [P.], seq 4600:4636, ack 1, win 501, options [nop,nop,TS val 364026995 ecr 3356239641], length 36
18:40:59.212535 eth0  Out IP comp3134-Winter2025.ssh > 198.96.84.204.8841: Flags [P.], seq 4636:4848, ack 1, win 501, options [nop,nop,TS val 364026995 ecr 3356239641], length 212
18:40:59.212589 eth0  Out IP comp3134-Winter2025.ssh > 198.96.84.204.8841: Flags [P.], seq 4848:4884, ack 1, win 501, options [nop,nop,TS val 364026995 ecr 3356239641], length 36
18:40:59.212660 eth0  Out IP comp3134-Winter2025.ssh > 198.96.84.204.8841: Flags [P.], seq 4884:5096, ack 1, win 501, options [nop,nop,TS val 364026996 ecr 3356239641], length 212
18:40:59.212754 eth0  Out IP comp3134-Winter2025.ssh > 198.96.84.204.8841: Flags [P.], seq 5096:5344, ack 1, win 501, options [nop,nop,TS val 364026996 ecr 3356239641], length 248
18:40:59.212820 eth0  Out IP comp3134-Winter2025.ssh > 198.96.84.204.8841: Flags [P.], seq 5344:5380, ack 1, win 501, options [nop,nop,TS val 364026996 ecr 3356239641], length 36
18:40:59.212886 eth0  Out IP comp3134-Winter2025.ssh > 198.96.84.204.8841: Flags [P.], seq 5380:5592, ack 1, win 501, options [nop,nop,TS val 364026996 ecr 3356239641], length 212
18:40:59.212939 eth0  Out IP comp3134-Winter2025.ssh > 198.96.84.204.8841: Flags [P.], seq 5592:5628, ack 1, win 501, options [nop,nop,TS val 364026996 ecr 3356239641], length 36
18:40:59.212983 eth0  Out IP comp3134-Winter2025.ssh > 198.96.84.204.8841: Flags [P.], seq 5628:5848, ack 1, win 501, options [nop,nop,TS val 364026996 ecr 3356239641], length 220
18:40:59.213023 eth0  Out IP comp3134-Winter2025.ssh > 198.96.84.204.8841: Flags [P.], seq 5848:5884, ack 1, win 501, options [nop,nop,TS val 364026996 ecr 3356239641], length 36
18:40:59.213101 eth0  Out IP comp3134-Winter2025.ssh > 198.96.84.204.8841: Flags [P.], seq 5884:6096, ack 1, win 501, options [nop,nop,TS val 364026996 ecr 3356239641], length 212
18:40:59.215148 eth0  In  IP 198.96.84.204.8841 > comp3134-Winter2025.ssh: Flags [.], ack 3340, win 1309, options [nop,nop,TS val 3356239651 ecr 364026994], length 0
18:40:59.215214 eth0  Out IP comp3134-Winter2025.ssh > 198.96.84.204.8841: Flags [P.], seq 6096:8572, ack 1, win 501, options [nop,nop,TS val 364026998 ecr 3356239651], length 2476
18:40:59.215238 eth0  Out IP comp3134-Winter2025.ssh > 198.96.84.204.8841: Flags [P.], seq 8572:10036, ack 1, win 501, options [nop,nop,TS val 364026998 ecr 3356239651], length 1464
18:40:59.221079 eth0  In  IP 198.96.84.204.8841 > comp3134-Winter2025.ssh: Flags [.], ack 6096, win 1309, options [nop,nop,TS val 3356239653 ecr 364026995], length 0
18:40:59.221080 eth0  In  IP 198.96.84.204.8841 > comp3134-Winter2025.ssh: Flags [.], ack 10036, win 1309, options [nop,nop,TS val 3356239655 ecr 364026998], length 0
18:40:59.311012 eth0  Out IP comp3134-Winter2025.ssh > 198.96.84.204.8841: Flags [P.], seq 10036:10296, ack 1, win 501, options [nop,nop,TS val 364027094 ecr 3356239655], length 260
18:40:59.311138 eth0  Out IP comp3134-Winter2025.ssh > 198.96.84.204.8841: Flags [P.], seq 10296:10576, ack 1, win 501, options [nop,nop,TS val 364027094 ecr 3356239655], length 280
18:40:59.311178 eth0  Out IP comp3134-Winter2025.ssh > 198.96.84.204.8841: Flags [P.], seq 10576:10612, ack 1, win 501, options [nop,nop,TS val 364027094 ecr 3356239655], length 36
18:40:59.311271 eth0  Out IP comp3134-Winter2025.ssh > 198.96.84.204.8841: Flags [P.], seq 10612:10816, ack 1, win 501, options [nop,nop,TS val 364027094 ecr 3356239655], length 204
18:40:59.311564 eth0  Out IP comp3134-Winter2025.ssh > 198.96.84.204.8841: Flags [P.], seq 10816:10852, ack 1, win 501, options [nop,nop,TS val 364027094 ecr 3356239655], length 36
18:40:59.311747 eth0  Out IP comp3134-Winter2025.ssh > 198.96.84.204.8841: Flags [P.], seq 10852:11072, ack 1, win 501, options [nop,nop,TS val 364027095 ecr 3356239655], length 220
18:40:59.311799 eth0  Out IP comp3134-Winter2025.ssh > 198.96.84.204.8841: Flags [P.], seq 11072:11108, ack 1, win 501, options [nop,nop,TS val 364027095 ecr 3356239655], length 36
18:40:59.311884 eth0  Out IP comp3134-Winter2025.ssh > 198.96.84.204.8841: Flags [P.], seq 11108:11320, ack 1, win 501, options [nop,nop,TS val 364027095 ecr 3356239655], length 212
18:40:59.311924 eth0  Out IP comp3134-Winter2025.ssh > 198.96.84.204.8841: Flags [P.], seq 11320:11356, ack 1, win 501, options [nop,nop,TS val 364027095 ecr 3356239655], length 36
18:40:59.311999 eth0  Out IP comp3134-Winter2025.ssh > 198.96.84.204.8841: Flags [P.], seq 11356:11576, ack 1, win 501, options [nop,nop,TS val 364027095 ecr 3356239655], length 220
18:40:59.312037 eth0  Out IP comp3134-Winter2025.ssh > 198.96.84.204.8841: Flags [P.], seq 11576:11612, ack 1, win 501, options [nop,nop,TS val 364027095 ecr 3356239655], length 36
18:40:59.312108 eth0  Out IP comp3134-Winter2025.ssh > 198.96.84.204.8841: Flags [P.], seq 11612:11824, ack 1, win 501, options [nop,nop,TS val 364027095 ecr 3356239655], length 212
18:40:59.312147 eth0  Out IP comp3134-Winter2025.ssh > 198.96.84.204.8841: Flags [P.], seq 11824:11860, ack 1, win 501, options [nop,nop,TS val 364027095 ecr 3356239655], length 36
18:40:59.312219 eth0  Out IP comp3134-Winter2025.ssh > 198.96.84.204.8841: Flags [P.], seq 11860:12080, ack 1, win 501, options [nop,nop,TS val 364027095 ecr 3356239655], length 220
18:40:59.312259 eth0  Out IP comp3134-Winter2025.ssh > 198.96.84.204.8841: Flags [P.], seq 12080:12116, ack 1, win 501, options [nop,nop,TS val 364027095 ecr 3356239655], length 36
18:40:59.312312 eth0  Out IP comp3134-Winter2025.ssh > 198.96.84.204.8841: Flags [P.], seq 12116:12328, ack 1, win 501, options [nop,nop,TS val 364027095 ecr 3356239655], length 212
18:40:59.312480 eth0  Out IP comp3134-Winter2025.ssh > 198.96.84.204.8841: Flags [P.], seq 12328:12364, ack 1, win 501, options [nop,nop,TS val 364027095 ecr 3356239655], length 36
18:40:59.312548 eth0  Out IP comp3134-Winter2025.ssh > 198.96.84.204.8841: Flags [P.], seq 12364:12584, ack 1, win 501, options [nop,nop,TS val 364027095 ecr 3356239655], length 220
18:40:59.312584 eth0  Out IP comp3134-Winter2025.ssh > 198.96.84.204.8841: Flags [P.], seq 12584:12620, ack 1, win 501, options [nop,nop,TS val 364027095 ecr 3356239655], length 36
18:40:59.312658 eth0  Out IP comp3134-Winter2025.ssh > 198.96.84.204.8841: Flags [P.], seq 12620:12832, ack 1, win 501, options [nop,nop,TS val 364027096 ecr 3356239655], length 212
18:40:59.312730 eth0  Out IP comp3134-Winter2025.ssh > 198.96.84.204.8841: Flags [P.], seq 12832:12868, ack 1, win 501, options [nop,nop,TS val 364027096 ecr 3356239655], length 36
18:40:59.312824 eth0  Out IP comp3134-Winter2025.ssh > 198.96.84.204.8841: Flags [P.], seq 12868:13088, ack 1, win 501, options [nop,nop,TS val 364027096 ecr 3356239655], length 220
18:40:59.312868 eth0  Out IP comp3134-Winter2025.ssh > 198.96.84.204.8841: Flags [P.], seq 13088:13124, ack 1, win 501, options [nop,nop,TS val 364027096 ecr 3356239655], length 36
18:40:59.312928 eth0  Out IP comp3134-Winter2025.ssh > 198.96.84.204.8841: Flags [P.], seq 13124:13344, ack 1, win 501, options [nop,nop,TS val 364027096 ecr 3356239655], length 220
18:40:59.312964 eth0  Out IP comp3134-Winter2025.ssh > 198.96.84.204.8841: Flags [P.], seq 13344:13380, ack 1, win 501, options [nop,nop,TS val 364027096 ecr 3356239655], length 36
18:40:59.313016 eth0  Out IP comp3134-Winter2025.ssh > 198.96.84.204.8841: Flags [P.], seq 13380:13592, ack 1, win 501, options [nop,nop,TS val 364027096 ecr 3356239655], length 212
18:40:59.313051 eth0  Out IP comp3134-Winter2025.ssh > 198.96.84.204.8841: Flags [P.], seq 13592:13628, ack 1, win 501, options [nop,nop,TS val 364027096 ecr 3356239655], length 36
18:40:59.313104 eth0  Out IP comp3134-Winter2025.ssh > 198.96.84.204.8841: Flags [P.], seq 13628:13848, ack 1, win 501, options [nop,nop,TS val 364027096 ecr 3356239655], length 220
18:40:59.313143 eth0  Out IP comp3134-Winter2025.ssh > 198.96.84.204.8841: Flags [P.], seq 13848:13884, ack 1, win 501, options [nop,nop,TS val 364027096 ecr 3356239655], length 36
18:40:59.313250 eth0  Out IP comp3134-Winter2025.ssh > 198.96.84.204.8841: Flags [P.], seq 13884:14096, ack 1, win 501, options [nop,nop,TS val 364027096 ecr 3356239655], length 212
18:40:59.313336 eth0  Out IP comp3134-Winter2025.ssh > 198.96.84.204.8841: Flags [P.], seq 14096:14352, ack 1, win 501, options [nop,nop,TS val 364027096 ecr 3356239655], length 256
18:40:59.313378 eth0  Out IP comp3134-Winter2025.ssh > 198.96.84.204.8841: Flags [P.], seq 14352:14388, ack 1, win 501, options [nop,nop,TS val 364027096 ecr 3356239655], length 36
18:40:59.313444 eth0  Out IP comp3134-Winter2025.ssh > 198.96.84.204.8841: Flags [P.], seq 14388:14608, ack 1, win 501, options [nop,nop,TS val 364027096 ecr 3356239655], length 220
18:40:59.313504 eth0  Out IP comp3134-Winter2025.ssh > 198.96.84.204.8841: Flags [P.], seq 14608:14644, ack 1, win 501, options [nop,nop,TS val 364027096 ecr 3356239655], length 36
18:40:59.313561 eth0  Out IP comp3134-Winter2025.ssh > 198.96.84.204.8841: Flags [P.], seq 14644:14856, ack 1, win 501, options [nop,nop,TS val 364027096 ecr 3356239655], length 212
18:40:59.313651 eth0  Out IP comp3134-Winter2025.ssh > 198.96.84.204.8841: Flags [P.], seq 14856:15148, ack 1, win 501, options [nop,nop,TS val 364027097 ecr 3356239655], length 292
18:40:59.313751 eth0  Out IP comp3134-Winter2025.ssh > 198.96.84.204.8841: Flags [P.], seq 15148:15360, ack 1, win 501, options [nop,nop,TS val 364027097 ecr 3356239655], length 212
18:40:59.313854 eth0  Out IP comp3134-Winter2025.ssh > 198.96.84.204.8841: Flags [P.], seq 15360:15396, ack 1, win 501, options [nop,nop,TS val 364027097 ecr 3356239655], length 36
18:40:59.313871 eth0  Out IP comp3134-Winter2025.ssh > 198.96.84.204.8841: Flags [P.], seq 15396:15616, ack 1, win 501, options [nop,nop,TS val 364027097 ecr 3356239655], length 220
18:40:59.313904 eth0  Out IP comp3134-Winter2025.ssh > 198.96.84.204.8841: Flags [P.], seq 15616:15652, ack 1, win 501, options [nop,nop,TS val 364027097 ecr 3356239655], length 36
18:40:59.313959 eth0  Out IP comp3134-Winter2025.ssh > 198.96.84.204.8841: Flags [P.], seq 15652:15864, ack 1, win 501, options [nop,nop,TS val 364027097 ecr 3356239655], length 212
18:40:59.313999 eth0  Out IP comp3134-Winter2025.ssh > 198.96.84.204.8841: Flags [P.], seq 15864:15900, ack 1, win 501, options [nop,nop,TS val 364027097 ecr 3356239655], length 36
18:40:59.314044 eth0  Out IP comp3134-Winter2025.ssh > 198.96.84.204.8841: Flags [P.], seq 15900:16120, ack 1, win 501, options [nop,nop,TS val 364027097 ecr 3356239655], length 220
18:40:59.314093 eth0  Out IP comp3134-Winter2025.ssh > 198.96.84.204.8841: Flags [P.], seq 16120:16156, ack 1, win 501, options [nop,nop,TS val 364027097 ecr 3356239655], length 36
18:40:59.314167 eth0  Out IP comp3134-Winter2025.ssh > 198.96.84.204.8841: Flags [P.], seq 16156:16360, ack 1, win 501, options [nop,nop,TS val 364027097 ecr 3356239655], length 204
18:40:59.314248 eth0  Out IP comp3134-Winter2025.ssh > 198.96.84.204.8841: Flags [P.], seq 16360:16396, ack 1, win 501, options [nop,nop,TS val 364027097 ecr 3356239655], length 36
18:40:59.321053 eth0  In  IP 198.96.84.204.8841 > comp3134-Winter2025.ssh: Flags [.], ack 15864, win 1309, options [nop,nop,TS val 3356239756 ecr 364027094], length 0
18:40:59.321053 eth0  In  IP 198.96.84.204.8841 > comp3134-Winter2025.ssh: Flags [.], ack 16396, win 1309, options [nop,nop,TS val 3356239756 ecr 364027097], length 0
18:40:59.321159 eth0  Out IP comp3134-Winter2025.ssh > 198.96.84.204.8841: Flags [P.], seq 16396:17388, ack 1, win 501, options [nop,nop,TS val 364027104 ecr 3356239756], length 992
18:40:59.324985 eth0  In  IP 198.96.84.204.8841 > comp3134-Winter2025.ssh: Flags [.], ack 17388, win 1309, options [nop,nop,TS val 3356239761 ecr 364027104], length 0
18:40:59.415612 eth0  Out IP comp3134-Winter2025.ssh > 198.96.84.204.8841: Flags [P.], seq 17388:17608, ack 1, win 501, options [nop,nop,TS val 364027198 ecr 3356239761], length 220
18:40:59.415763 eth0  Out IP comp3134-Winter2025.ssh > 198.96.84.204.8841: Flags [P.], seq 17608:17644, ack 1, win 501, options [nop,nop,TS val 364027199 ecr 3356239761], length 36
18:40:59.415817 eth0  Out IP comp3134-Winter2025.ssh > 198.96.84.204.8841: Flags [P.], seq 17644:17864, ack 1, win 501, options [nop,nop,TS val 364027199 ecr 3356239761], length 220
18:40:59.415882 eth0  Out IP comp3134-Winter2025.ssh > 198.96.84.204.8841: Flags [P.], seq 17864:17900, ack 1, win 501, options [nop,nop,TS val 364027199 ecr 3356239761], length 36
18:40:59.415943 eth0  Out IP comp3134-Winter2025.ssh > 198.96.84.204.8841: Flags [P.], seq 17900:18120, ack 1, win 501, options [nop,nop,TS val 364027199 ecr 3356239761], length 220
18:40:59.415987 eth0  Out IP comp3134-Winter2025.ssh > 198.96.84.204.8841: Flags [P.], seq 18120:18156, ack 1, win 501, options [nop,nop,TS val 364027199 ecr 3356239761], length 36
18:40:59.416048 eth0  Out IP comp3134-Winter2025.ssh > 198.96.84.204.8841: Flags [P.], seq 18156:18376, ack 1, win 501, options [nop,nop,TS val 364027199 ecr 3356239761], length 220
18:40:59.416126 eth0  Out IP comp3134-Winter2025.ssh > 198.96.84.204.8841: Flags [P.], seq 18376:18412, ack 1, win 501, options [nop,nop,TS val 364027199 ecr 3356239761], length 36
18:40:59.416204 eth0  Out IP comp3134-Winter2025.ssh > 198.96.84.204.8841: Flags [P.], seq 18412:18632, ack 1, win 501, options [nop,nop,TS val 364027199 ecr 3356239761], length 220
18:40:59.416257 eth0  Out IP comp3134-Winter2025.ssh > 198.96.84.204.8841: Flags [P.], seq 18632:18668, ack 1, win 501, options [nop,nop,TS val 364027199 ecr 3356239761], length 36
18:40:59.416308 eth0  Out IP comp3134-Winter2025.ssh > 198.96.84.204.8841: Flags [P.], seq 18668:18888, ack 1, win 501, options [nop,nop,TS val 364027199 ecr 3356239761], length 220
18:40:59.416339 eth0  Out IP comp3134-Winter2025.ssh > 198.96.84.204.8841: Flags [P.], seq 18888:18924, ack 1, win 501, options [nop,nop,TS val 364027199 ecr 3356239761], length 36
18:40:59.416388 eth0  Out IP comp3134-Winter2025.ssh > 198.96.84.204.8841: Flags [P.], seq 18924:19144, ack 1, win 501, options [nop,nop,TS val 364027199 ecr 3356239761], length 220
18:40:59.416431 eth0  Out IP comp3134-Winter2025.ssh > 198.96.84.204.8841: Flags [P.], seq 19144:19180, ack 1, win 501, options [nop,nop,TS val 364027199 ecr 3356239761], length 36
18:40:59.416468 eth0  Out IP comp3134-Winter2025.ssh > 198.96.84.204.8841: Flags [P.], seq 19180:19400, ack 1, win 501, options [nop,nop,TS val 364027199 ecr 3356239761], length 220
18:40:59.416531 eth0  Out IP comp3134-Winter2025.ssh > 198.96.84.204.8841: Flags [P.], seq 19400:19656, ack 1, win 501, options [nop,nop,TS val 364027199 ecr 3356239761], length 256
18:40:59.416601 eth0  Out IP comp3134-Winter2025.ssh > 198.96.84.204.8841: Flags [P.], seq 19656:19692, ack 1, win 501, options [nop,nop,TS val 364027199 ecr 3356239761], length 36
18:40:59.416652 eth0  Out IP comp3134-Winter2025.ssh > 198.96.84.204.8841: Flags [P.], seq 19692:19912, ack 1, win 501, options [nop,nop,TS val 364027200 ecr 3356239761], length 220
18:40:59.416702 eth0  Out IP comp3134-Winter2025.ssh > 198.96.84.204.8841: Flags [P.], seq 19912:19948, ack 1, win 501, options [nop,nop,TS val 364027200 ecr 3356239761], length 36
18:40:59.416785 eth0  Out IP comp3134-Winter2025.ssh > 198.96.84.204.8841: Flags [P.], seq 19948:20168, ack 1, win 501, options [nop,nop,TS val 364027200 ecr 3356239761], length 220
18:40:59.416928 eth0  Out IP comp3134-Winter2025.ssh > 198.96.84.204.8841: Flags [P.], seq 20168:20680, ack 1, win 501, options [nop,nop,TS val 364027200 ecr 3356239761], length 512
18:40:59.416972 eth0  Out IP comp3134-Winter2025.ssh > 198.96.84.204.8841: Flags [P.], seq 20680:20716, ack 1, win 501, options [nop,nop,TS val 364027200 ecr 3356239761], length 36
18:40:59.417048 eth0  Out IP comp3134-Winter2025.ssh > 198.96.84.204.8841: Flags [P.], seq 20716:20936, ack 1, win 501, options [nop,nop,TS val 364027200 ecr 3356239761], length 220
18:40:59.417086 eth0  Out IP comp3134-Winter2025.ssh > 198.96.84.204.8841: Flags [P.], seq 20936:20972, ack 1, win 501, options [nop,nop,TS val 364027200 ecr 3356239761], length 36
18:40:59.417151 eth0  Out IP comp3134-Winter2025.ssh > 198.96.84.204.8841: Flags [P.], seq 20972:21192, ack 1, win 501, options [nop,nop,TS val 364027200 ecr 3356239761], length 220
18:40:59.417255 eth0  Out IP comp3134-Winter2025.ssh > 198.96.84.204.8841: Flags [P.], seq 21192:21228, ack 1, win 501, options [nop,nop,TS val 364027200 ecr 3356239761], length 36
18:40:59.417278 eth0  Out IP comp3134-Winter2025.ssh > 198.96.84.204.8841: Flags [P.], seq 21228:21448, ack 1, win 501, options [nop,nop,TS val 364027200 ecr 3356239761], length 220
18:40:59.417413 eth0  Out IP comp3134-Winter2025.ssh > 198.96.84.204.8841: Flags [P.], seq 21448:21740, ack 1, win 501, options [nop,nop,TS val 364027200 ecr 3356239761], length 292
18:40:59.417443 eth0  Out IP comp3134-Winter2025.ssh > 198.96.84.204.8841: Flags [P.], seq 21740:21960, ack 1, win 501, options [nop,nop,TS val 364027200 ecr 3356239761], length 220
18:40:59.417480 eth0  Out IP comp3134-Winter2025.ssh > 198.96.84.204.8841: Flags [P.], seq 21960:21996, ack 1, win 501, options [nop,nop,TS val 364027200 ecr 3356239761], length 36
18:40:59.417553 eth0  Out IP comp3134-Winter2025.ssh > 198.96.84.204.8841: Flags [P.], seq 21996:22216, ack 1, win 501, options [nop,nop,TS val 364027200 ecr 3356239761], length 220
18:40:59.417596 eth0  Out IP comp3134-Winter2025.ssh > 198.96.84.204.8841: Flags [P.], seq 22216:22252, ack 1, win 501, options [nop,nop,TS val 364027200 ecr 3356239761], length 36
18:40:59.417668 eth0  Out IP comp3134-Winter2025.ssh > 198.96.84.204.8841: Flags [P.], seq 22252:22472, ack 1, win 501, options [nop,nop,TS val 364027201 ecr 3356239761], length 220
18:40:59.417709 eth0  Out IP comp3134-Winter2025.ssh > 198.96.84.204.8841: Flags [P.], seq 22472:22508, ack 1, win 501, options [nop,nop,TS val 364027201 ecr 3356239761], length 36
18:40:59.417787 eth0  Out IP comp3134-Winter2025.ssh > 198.96.84.204.8841: Flags [P.], seq 22508:22728, ack 1, win 501, options [nop,nop,TS val 364027201 ecr 3356239761], length 220
18:40:59.417834 eth0  Out IP comp3134-Winter2025.ssh > 198.96.84.204.8841: Flags [P.], seq 22728:22764, ack 1, win 501, options [nop,nop,TS val 364027201 ecr 3356239761], length 36
18:40:59.417907 eth0  Out IP comp3134-Winter2025.ssh > 198.96.84.204.8841: Flags [P.], seq 22764:22984, ack 1, win 501, options [nop,nop,TS val 364027201 ecr 3356239761], length 220
18:40:59.418020 eth0  Out IP comp3134-Winter2025.ssh > 198.96.84.204.8841: Flags [P.], seq 22984:23020, ack 1, win 501, options [nop,nop,TS val 364027201 ecr 3356239761], length 36
18:40:59.418059 eth0  Out IP comp3134-Winter2025.ssh > 198.96.84.204.8841: Flags [P.], seq 23020:23240, ack 1, win 501, options [nop,nop,TS val 364027201 ecr 3356239761], length 220
18:40:59.418106 eth0  Out IP comp3134-Winter2025.ssh > 198.96.84.204.8841: Flags [P.], seq 23240:23276, ack 1, win 501, options [nop,nop,TS val 364027201 ecr 3356239761], length 36
18:40:59.418189 eth0  Out IP comp3134-Winter2025.ssh > 198.96.84.204.8841: Flags [P.], seq 23276:23496, ack 1, win 501, options [nop,nop,TS val 364027201 ecr 3356239761], length 220
18:40:59.418235 eth0  Out IP comp3134-Winter2025.ssh > 198.96.84.204.8841: Flags [P.], seq 23496:23532, ack 1, win 501, options [nop,nop,TS val 364027201 ecr 3356239761], length 36
18:40:59.418292 eth0  Out IP comp3134-Winter2025.ssh > 198.96.84.204.8841: Flags [P.], seq 23532:23752, ack 1, win 501, options [nop,nop,TS val 364027201 ecr 3356239761], length 220
18:40:59.418320 eth0  Out IP comp3134-Winter2025.ssh > 198.96.84.204.8841: Flags [P.], seq 23752:23788, ack 1, win 501, options [nop,nop,TS val 364027201 ecr 3356239761], length 36
18:40:59.418364 eth0  Out IP comp3134-Winter2025.ssh > 198.96.84.204.8841: Flags [P.], seq 23788:24008, ack 1, win 501, options [nop,nop,TS val 364027201 ecr 3356239761], length 220
18:40:59.418391 eth0  Out IP comp3134-Winter2025.ssh > 198.96.84.204.8841: Flags [P.], seq 24008:24044, ack 1, win 501, options [nop,nop,TS val 364027201 ecr 3356239761], length 36
18:40:59.418437 eth0  Out IP comp3134-Winter2025.ssh > 198.96.84.204.8841: Flags [P.], seq 24044:24264, ack 1, win 501, options [nop,nop,TS val 364027201 ecr 3356239761], length 220
18:40:59.418465 eth0  Out IP comp3134-Winter2025.ssh > 198.96.84.204.8841: Flags [P.], seq 24264:24300, ack 1, win 501, options [nop,nop,TS val 364027201 ecr 3356239761], length 36
18:40:59.418513 eth0  Out IP comp3134-Winter2025.ssh > 198.96.84.204.8841: Flags [P.], seq 24300:24520, ack 1, win 501, options [nop,nop,TS val 364027201 ecr 3356239761], length 220
18:40:59.418542 eth0  Out IP comp3134-Winter2025.ssh > 198.96.84.204.8841: Flags [P.], seq 24520:24556, ack 1, win 501, options [nop,nop,TS val 364027201 ecr 3356239761], length 36
18:40:59.418587 eth0  Out IP comp3134-Winter2025.ssh > 198.96.84.204.8841: Flags [P.], seq 24556:24776, ack 1, win 501, options [nop,nop,TS val 364027201 ecr 3356239761], length 220
18:40:59.418698 eth0  Out IP comp3134-Winter2025.ssh > 198.96.84.204.8841: Flags [P.], seq 24776:25032, ack 1, win 501, options [nop,nop,TS val 364027202 ecr 3356239761], length 256
18:40:59.418742 eth0  Out IP comp3134-Winter2025.ssh > 198.96.84.204.8841: Flags [P.], seq 25032:25068, ack 1, win 501, options [nop,nop,TS val 364027202 ecr 3356239761], length 36
18:40:59.418810 eth0  Out IP comp3134-Winter2025.ssh > 198.96.84.204.8841: Flags [P.], seq 25068:25288, ack 1, win 501, options [nop,nop,TS val 364027202 ecr 3356239761], length 220
18:40:59.418854 eth0  Out IP comp3134-Winter2025.ssh > 198.96.84.204.8841: Flags [P.], seq 25288:25324, ack 1, win 501, options [nop,nop,TS val 364027202 ecr 3356239761], length 36
18:40:59.418926 eth0  Out IP comp3134-Winter2025.ssh > 198.96.84.204.8841: Flags [P.], seq 25324:25544, ack 1, win 501, options [nop,nop,TS val 364027202 ecr 3356239761], length 220
18:40:59.418965 eth0  Out IP comp3134-Winter2025.ssh > 198.96.84.204.8841: Flags [P.], seq 25544:25580, ack 1, win 501, options [nop,nop,TS val 364027202 ecr 3356239761], length 36
18:40:59.426826 eth0  In  IP 198.96.84.204.8841 > comp3134-Winter2025.ssh: Flags [.], ack 21996, win 1309, options [nop,nop,TS val 3356239861 ecr 364027198], length 0
18:40:59.426911 eth0  Out IP comp3134-Winter2025.ssh > 198.96.84.204.8841: Flags [P.], seq 25580:28056, ack 1, win 501, options [nop,nop,TS val 364027210 ecr 3356239861], length 2476
18:40:59.426940 eth0  Out IP comp3134-Winter2025.ssh > 198.96.84.204.8841: Flags [P.], seq 28056:30140, ack 1, win 501, options [nop,nop,TS val 364027210 ecr 3356239861], length 2084
18:40:59.437399 eth0  In  IP 198.96.84.204.8841 > comp3134-Winter2025.ssh: Flags [.], ack 30140, win 1309, options [nop,nop,TS val 3356239873 ecr 364027200], length 0
18:40:59.518994 eth0  Out IP comp3134-Winter2025.ssh > 198.96.84.204.8841: Flags [P.], seq 30140:30360, ack 1, win 501, options [nop,nop,TS val 364027302 ecr 3356239873], length 220
18:40:59.519071 eth0  Out IP comp3134-Winter2025.ssh > 198.96.84.204.8841: Flags [P.], seq 30360:30396, ack 1, win 501, options [nop,nop,TS val 364027302 ecr 3356239873], length 36
18:40:59.519155 eth0  Out IP comp3134-Winter2025.ssh > 198.96.84.204.8841: Flags [P.], seq 30396:30616, ack 1, win 501, options [nop,nop,TS val 364027302 ecr 3356239873], length 220
18:40:59.519194 eth0  Out IP comp3134-Winter2025.ssh > 198.96.84.204.8841: Flags [P.], seq 30616:30652, ack 1, win 501, options [nop,nop,TS val 364027302 ecr 3356239873], length 36
18:40:59.519258 eth0  Out IP comp3134-Winter2025.ssh > 198.96.84.204.8841: Flags [P.], seq 30652:30872, ack 1, win 501, options [nop,nop,TS val 364027302 ecr 3356239873], length 220
18:40:59.519471 eth0  Out IP comp3134-Winter2025.ssh > 198.96.84.204.8841: Flags [P.], seq 30872:30908, ack 1, win 501, options [nop,nop,TS val 364027302 ecr 3356239873], length 36
18:40:59.519598 eth0  Out IP comp3134-Winter2025.ssh > 198.96.84.204.8841: Flags [P.], seq 30908:31128, ack 1, win 501, options [nop,nop,TS val 364027302 ecr 3356239873], length 220
18:40:59.519638 eth0  Out IP comp3134-Winter2025.ssh > 198.96.84.204.8841: Flags [P.], seq 31128:31164, ack 1, win 501, options [nop,nop,TS val 364027303 ecr 3356239873], length 36
18:40:59.519704 eth0  Out IP comp3134-Winter2025.ssh > 198.96.84.204.8841: Flags [P.], seq 31164:31384, ack 1, win 501, options [nop,nop,TS val 364027303 ecr 3356239873], length 220
18:40:59.519741 eth0  Out IP comp3134-Winter2025.ssh > 198.96.84.204.8841: Flags [P.], seq 31384:31420, ack 1, win 501, options [nop,nop,TS val 364027303 ecr 3356239873], length 36
18:40:59.519805 eth0  Out IP comp3134-Winter2025.ssh > 198.96.84.204.8841: Flags [P.], seq 31420:31640, ack 1, win 501, options [nop,nop,TS val 364027303 ecr 3356239873], length 220
18:40:59.519842 eth0  Out IP comp3134-Winter2025.ssh > 198.96.84.204.8841: Flags [P.], seq 31640:31676, ack 1, win 501, options [nop,nop,TS val 364027303 ecr 3356239873], length 36
18:40:59.519906 eth0  Out IP comp3134-Winter2025.ssh > 198.96.84.204.8841: Flags [P.], seq 31676:31896, ack 1, win 501, options [nop,nop,TS val 364027303 ecr 3356239873], length 220
18:40:59.519942 eth0  Out IP comp3134-Winter2025.ssh > 198.96.84.204.8841: Flags [P.], seq 31896:31932, ack 1, win 501, options [nop,nop,TS val 364027303 ecr 3356239873], length 36
18:40:59.520009 eth0  Out IP comp3134-Winter2025.ssh > 198.96.84.204.8841: Flags [P.], seq 31932:32152, ack 1, win 501, options [nop,nop,TS val 364027303 ecr 3356239873], length 220
18:40:59.520047 eth0  Out IP comp3134-Winter2025.ssh > 198.96.84.204.8841: Flags [P.], seq 32152:32188, ack 1, win 501, options [nop,nop,TS val 364027303 ecr 3356239873], length 36
18:40:59.520111 eth0  Out IP comp3134-Winter2025.ssh > 198.96.84.204.8841: Flags [P.], seq 32188:32408, ack 1, win 501, options [nop,nop,TS val 364027303 ecr 3356239873], length 220
18:40:59.520150 eth0  Out IP comp3134-Winter2025.ssh > 198.96.84.204.8841: Flags [P.], seq 32408:32444, ack 1, win 501, options [nop,nop,TS val 364027303 ecr 3356239873], length 36
18:40:59.520214 eth0  Out IP comp3134-Winter2025.ssh > 198.96.84.204.8841: Flags [P.], seq 32444:32664, ack 1, win 501, options [nop,nop,TS val 364027303 ecr 3356239873], length 220
18:40:59.520251 eth0  Out IP comp3134-Winter2025.ssh > 198.96.84.204.8841: Flags [P.], seq 32664:32700, ack 1, win 501, options [nop,nop,TS val 364027303 ecr 3356239873], length 36
18:40:59.520318 eth0  Out IP comp3134-Winter2025.ssh > 198.96.84.204.8841: Flags [P.], seq 32700:32920, ack 1, win 501, options [nop,nop,TS val 364027303 ecr 3356239873], length 220
18:40:59.520356 eth0  Out IP comp3134-Winter2025.ssh > 198.96.84.204.8841: Flags [P.], seq 32920:32956, ack 1, win 501, options [nop,nop,TS val 364027303 ecr 3356239873], length 36
18:40:59.520420 eth0  Out IP comp3134-Winter2025.ssh > 198.96.84.204.8841: Flags [P.], seq 32956:33176, ack 1, win 501, options [nop,nop,TS val 364027303 ecr 3356239873], length 220
18:40:59.520458 eth0  Out IP comp3134-Winter2025.ssh > 198.96.84.204.8841: Flags [P.], seq 33176:33212, ack 1, win 501, options [nop,nop,TS val 364027303 ecr 3356239873], length 36
18:40:59.520521 eth0  Out IP comp3134-Winter2025.ssh > 198.96.84.204.8841: Flags [P.], seq 33212:33432, ack 1, win 501, options [nop,nop,TS val 364027303 ecr 3356239873], length 220
18:40:59.520558 eth0  Out IP comp3134-Winter2025.ssh > 198.96.84.204.8841: Flags [P.], seq 33432:33468, ack 1, win 501, options [nop,nop,TS val 364027303 ecr 3356239873], length 36
18:40:59.520620 eth0  Out IP comp3134-Winter2025.ssh > 198.96.84.204.8841: Flags [P.], seq 33468:33688, ack 1, win 501, options [nop,nop,TS val 364027303 ecr 3356239873], length 220
18:40:59.520658 eth0  Out IP comp3134-Winter2025.ssh > 198.96.84.204.8841: Flags [P.], seq 33688:33724, ack 1, win 501, options [nop,nop,TS val 364027304 ecr 3356239873], length 36
18:40:59.520720 eth0  Out IP comp3134-Winter2025.ssh > 198.96.84.204.8841: Flags [P.], seq 33724:33944, ack 1, win 501, options [nop,nop,TS val 364027304 ecr 3356239873], length 220
18:40:59.520758 eth0  Out IP comp3134-Winter2025.ssh > 198.96.84.204.8841: Flags [P.], seq 33944:33980, ack 1, win 501, options [nop,nop,TS val 364027304 ecr 3356239873], length 36
18:40:59.520817 eth0  Out IP comp3134-Winter2025.ssh > 198.96.84.204.8841: Flags [P.], seq 33980:34200, ack 1, win 501, options [nop,nop,TS val 364027304 ecr 3356239873], length 220
18:40:59.520854 eth0  Out IP comp3134-Winter2025.ssh > 198.96.84.204.8841: Flags [P.], seq 34200:34236, ack 1, win 501, options [nop,nop,TS val 364027304 ecr 3356239873], length 36
18:40:59.520915 eth0  Out IP comp3134-Winter2025.ssh > 198.96.84.204.8841: Flags [P.], seq 34236:34456, ack 1, win 501, options [nop,nop,TS val 364027304 ecr 3356239873], length 220
18:40:59.520950 eth0  Out IP comp3134-Winter2025.ssh > 198.96.84.204.8841: Flags [P.], seq 34456:34492, ack 1, win 501, options [nop,nop,TS val 364027304 ecr 3356239873], length 36
18:40:59.521004 eth0  Out IP comp3134-Winter2025.ssh > 198.96.84.204.8841: Flags [P.], seq 34492:34712, ack 1, win 501, options [nop,nop,TS val 364027304 ecr 3356239873], length 220
18:40:59.521056 eth0  Out IP comp3134-Winter2025.ssh > 198.96.84.204.8841: Flags [P.], seq 34712:34748, ack 1, win 501, options [nop,nop,TS val 364027304 ecr 3356239873], length 36
18:40:59.521109 eth0  Out IP comp3134-Winter2025.ssh > 198.96.84.204.8841: Flags [P.], seq 34748:34968, ack 1, win 501, options [nop,nop,TS val 364027304 ecr 3356239873], length 220
18:40:59.521154 eth0  Out IP comp3134-Winter2025.ssh > 198.96.84.204.8841: Flags [P.], seq 34968:35004, ack 1, win 501, options [nop,nop,TS val 364027304 ecr 3356239873], length 36
18:40:59.521190 eth0  Out IP comp3134-Winter2025.ssh > 198.96.84.204.8841: Flags [P.], seq 35004:35224, ack 1, win 501, options [nop,nop,TS val 364027304 ecr 3356239873], length 220
18:40:59.521217 eth0  Out IP comp3134-Winter2025.ssh > 198.96.84.204.8841: Flags [P.], seq 35224:35260, ack 1, win 501, options [nop,nop,TS val 364027304 ecr 3356239873], length 36
18:40:59.521263 eth0  Out IP comp3134-Winter2025.ssh > 198.96.84.204.8841: Flags [P.], seq 35260:35480, ack 1, win 501, options [nop,nop,TS val 364027304 ecr 3356239873], length 220
18:40:59.521291 eth0  Out IP comp3134-Winter2025.ssh > 198.96.84.204.8841: Flags [P.], seq 35480:35516, ack 1, win 501, options [nop,nop,TS val 364027304 ecr 3356239873], length 36
